type,jan_regis,feb_regis,mar_regis,apr_regis,may_regis,jun_regis,jul_regis,aug_regis,sep_regis,oct_regis,nov_regis,dec_regis,total_regis,jan_m,feb_m,mar_m,apr_m,may_m,jun_m,jul_m,aug_m,sep_m,oct_m,nov_m,dec_m,total_m
กิจกรรมการดูแลสิทธิในการผลิตซ้ำดนตรีเพื่อจำหน่ายหรือเผยแพร่,0,1,1,1,1,1,1,0,1,0,0,1,8,0.0,0.5,1.0,0.05,1.0,0.1,1.0,0.0,1.0,0.0,0.0,0.2,4.8500000000000005
การออกอากาศทางวิทยุกระจายเสียง,0,0,0,0,0,0,0,0,0,0,0,0,0,0.0,0.0,0.0,0.0,0.0,0.0,0.0,0.0,0.0,0.0,0.0,0.0,0.0
การออกอากาศทางวิทยุกระจายเสียง (ยกเว้นทางออนไลน์),0,1,0,0,1,0,1,2,1,0,1,0,7,0.0,2.0,0.0,0.0,0.3,0.0,0.1,1.2,1.0,0.0,0.3,0.0,4.9
การออกอากาศทางวิทยุกระจายเสียงผ่านทางออนไลน์,0,2,0,4,0,0,1,0,1,0,3,0,11,0.0,2.1,0.0,17.5,0.0,0.0,0.2,0.0,1.0,0.0,5.1,0.0,25.9
การจัดผังรายการและการออกอากาศทางโทรทัศน์,0,0,0,0,0,0,0,0,0,0,0,0,0,0.0,0.0,0.0,0.0,0.0,0.0,0.0,0.0,0.0,0.0,0.0,0.0,0.0
การจัดผังรายการและการออกอากาศทางโทรทัศน์โดยไม่ต้องสมัครสมาชิก (ยกเว้นทางออนไลน์),0,0,0,0,0,0,0,0,0,0,0,0,0,0.0,0.0,0.0,0.0,0.0,0.0,0.0,0.0,0.0,0.0,0.0,0.0,0.0
การจัดผังรายการและการออกอากาศทางโทรทัศน์โดยสมัครสมาชิก (ยกเว้นทางออนไลน์),0,0,0,0,0,0,0,0,0,0,0,0,0,0.0,0.0,0.0,0.0,0.0,0.0,0.0,0.0,0.0,0.0,0.0,0.0,0.0
การจัดผังรายการและการออกอากาศทางโทรทัศน์ผ่านทางออนไลน์,0,3,0,2,2,1,1,0,1,1,2,1,14,0.0,3.0,0.0,1.1,2.5,0.1,2.0,0.0,1.0,1.0,4.1,1.0,15.8
การโทรคมนาคม,0,0,0,0,0,0,0,0,0,0,0,0,0,0.0,0.0,0.0,0.0,0.0,0.0,0.0,0.0,0.0,0.0,0.0,0.0,0.0
การบริการอินเทอร์เน็ตแบบใช้สายและไร้สาย,2,1,0,4,2,2,1,1,2,2,2,1,20,3.0,2.0,0.0,7.0,2.0,1.15,2.0,1.0,2.0,3.0,1.1,0.3,24.55
การบริการจัดส่งสัญญาณโทรทัศน์/วิทยุผ่านสายเคเบิล,0,0,0,0,0,0,1,0,0,0,0,0,1,0.0,0.0,0.0,0.0,0.0,0.0,1.0,0.0,0.0,0.0,0.0,0.0,1.0
กิจกรรมการโทรคมนาคมแบบใช้สายอื่นๆซึ่งมิได้จัดประเภทไว้ในที่อื่น,1,0,0,0,0,5,0,0,1,1,0,1,9,1.0,0.0,0.0,0.0,0.0,5.0,0.0,0.0,1.0,5.0,0.0,1.0,13.0
กิจกรรมการโทรคมนาคมแบบไร้สาย,0,0,0,0,0,0,0,0,0,0,0,0,0,0.0,0.0,0.0,0.0,0.0,0.0,0.0,0.0,0.0,0.0,0.0,0.0,0.0
การบริการระบบโทรศัพท์เคลื่อนที่,1,0,0,0,1,0,0,0,0,0,0,0,2,1.0,0.0,0.0,0.0,2.0,0.0,0.0,0.0,0.0,0.0,0.0,0.0,3.0
การบริการอินเทอร์เน็ตแบบไร้สาย,1,1,1,0,0,0,0,0,0,0,0,1,4,1.0,0.01,0.5,0.0,0.0,0.0,0.0,0.0,0.0,0.0,0.0,0.1,1.61
กิจกรรมการโทรคมนาคมแบบไร้สายอื่นๆซึ่งมิได้จัดประเภทไว้ในที่อื่น,0,0,0,0,1,0,0,0,0,3,0,0,4,0.0,0.0,0.0,0.0,1.0,0.0,0.0,0.0,0.0,3.0,0.0,0.0,4.0
การบริการจัดส่งสัญญาณรายการโทรทัศน์/วิทยุผ่านดาวเทียม,0,0,0,0,0,0,0,0,0,0,0,0,0,0.0,0.0,0.0,0.0,0.0,0.0,0.0,0.0,0.0,0.0,0.0,0.0,0.0
กิจกรรมการโทรคมนาคมผ่านดาวเทียม (ยกเว้นการบริการจัดส่งสัญญาณรายการโทรทัศน์/วิทยุผ่านดาวเทียม),0,1,0,0,0,2,0,0,0,0,0,0,3,0.0,0.1,0.0,0.0,0.0,4.1,0.0,0.0,0.0,0.0,0.0,0.0,4.199999999999999
กิจกรรมการโทรคมนาคมด้านอื่นๆ,1,2,1,1,2,1,2,0,1,1,1,0,13,2.5,2.4,2.0,1.0,2.0,1.0,2.0,0.0,0.5,5.0,1.0,0.0,19.4
กิจกรรมการจัดทำโปรแกรมคอมพิวเตอร์การให้คำปรึกษาเกี่ยวกับคอมพิวเตอร์และกิจกรรมที่เกี่ยวข้อง,0,0,0,0,0,0,0,0,0,0,0,0,0,0.0,0.0,0.0,0.0,0.0,0.0,0.0,0.0,0.0,0.0,0.0,0.0,0.0
กิจกรรมการจัดทำโปรแกรมคอมพิวเตอร์ตามวัตถุประสงค์ของผู้ใช้,0,0,0,0,0,0,0,0,0,0,0,0,0,0.0,0.0,0.0,0.0,0.0,0.0,0.0,0.0,0.0,0.0,0.0,0.0,0.0
กิจกรรมการจัดทำโปรแกรมเว็บเพจและเครือข่ายตามวัตถุประสงค์ของผู้ใช้,27,25,32,20,27,27,30,35,24,31,19,18,315,37.6,53.55,34.71,25.6,40.06,32.15,38.875,46.52,32.5,40.64333,23.2,18.4,423.80833
กิจกรรมการจัดทำโปรแกรมคอมพิวเตอร์ตามวัตถุประสงค์ของผู้ใช้ (ยกเว้นโปรแกรมเว็บเพจและเครือข่าย),57,37,23,37,40,36,53,48,36,42,33,25,467,288.76,60.6,37.65,66.3,115.667388,77.2978,98.515,60.43,75.611,93.38,54.66,40.411,1069.282188
กิจกรรมการให้คำปรึกษาเกี่ยวกับคอมพิวเตอร์และการจัดการสิ่งอำนวยความสะดวกด้านคอมพิวเตอร์,0,0,0,0,0,0,0,0,0,0,0,0,0,0.0,0.0,0.0,0.0,0.0,0.0,0.0,0.0,0.0,0.0,0.0,0.0,0.0
กิจกรรมการให้คำปรึกษาทางด้านฮาร์ดแวร์,2,0,3,1,1,1,0,0,0,2,4,0,14,6.0,0.0,2.002,5.0,1.0,0.1,0.0,0.0,0.0,4.0,11.0,0.0,29.102
กิจกรรมการให้คำปรึกษาทางด้านซอฟต์แวร์,18,31,22,23,20,17,21,24,31,14,17,8,246,27.8,53.2,44.918888,27.999,41.29,26.35,37.1,36.0,62.25,20.7,17.81,14.601,410.018888
กิจกรรมการจัดการสิ่งอำนวยความสะดวกด้านคอมพิวเตอร์,12,7,6,3,10,8,10,7,7,4,3,2,79,29.0,10.0,9.2,1.3,59.0,22.2,16.2,11.0,10.7,6.5,2.1,1.5,178.69999999999996
กิจกรรมการบริการเทคโนโลยีสารสนเทศและคอมพิวเตอร์อื่นๆ,14,10,10,11,10,14,10,16,15,12,7,20,149,130.4,15.5,12.9,17.1,21.1,29.43,112.525,22.95,69.3,19.302,6.2,32.1,488.8070000000001
การประมวลผลข้อมูลการสร้างแม่ข่ายและกิจกรรมที่เกี่ยวข้อง,0,0,0,0,0,0,0,0,0,0,0,0,0,0.0,0.0,0.0,0.0,0.0,0.0,0.0,0.0,0.0,0.0,0.0,0.0,0.0
กิจกรรมการบริหารจัดการและประมวลผลข้อมูล,3,3,3,3,3,2,11,10,3,7,5,8,61,3.0,4.0,10.1,4.1,4.2,6.0,10.45,11.55,1.2,12.0,12.06,20.2,98.86
กิจกรรมการสร้างแม่ข่าย,6,8,6,10,5,10,3,12,8,9,5,2,84,3.6,12.41,5.438,18.22,7.0,22.2,4.1,3458.79,9.21,10.2,5.0,3.0,3559.168
การบริการเป็นตลาดกลางในการซื้อขายสินค้าหรือบริการ โดยวิธีใช้สื่ออิเล็กทรอนิกส์ผ่านระบบเครือข่ายอินเทอร์เน็ต,17,9,12,8,14,11,19,8,23,25,25,15,186,35.54,8.8,8.6,26.9864,20.3,23.6,28.46,11.04,33.02,34.12,33.906,20.3,284.67240000000004
เวบท่า,2,0,1,3,0,0,1,1,0,2,2,0,12,3.0,0.0,1.0,2.124,0.0,0.0,4.0,1.0,0.0,4.5,0.3,0.0,15.924
กิจกรรมสำนักข่าว,0,0,0,0,0,0,0,0,0,0,0,0,0,0.0,0.0,0.0,0.0,0.0,0.0,0.0,0.0,0.0,0.0,0.0,0.0,0.0
กิจกรรมสำนักข่าวสื่อสิ่งพิมพ์,0,0,1,0,0,0,0,0,0,1,0,0,2,0.0,0.0,1.0,0.0,0.0,0.0,0.0,0.0,0.0,1.0,0.0,0.0,2.0
กิจกรรมสำนักข่าวสื่อโสตทัศน์,0,1,0,0,0,0,1,1,0,0,2,0,5,0.0,1.0,0.0,0.0,0.0,0.0,1.0,1.0,0.0,0.0,0.6,0.0,3.6
กิจกรรมบริการสารสนเทศอื่นๆซึ่งมิได้จัดประเภทไว้ในที่อื่น,0,0,1,0,1,0,1,1,1,1,6,1,13,0.0,0.0,1.0,0.0,1.0,0.0,0.01,1.0,0.1,1.0,9.0,1.0,14.11
กิจกรรมบริการทางการเงิน ยกเว้น การประกันภัยและกองทุนบำเหน็จบำนาญ,0,0,0,0,0,0,0,0,0,0,0,0,0,0.0,0.0,0.0,0.0,0.0,0.0,0.0,0.0,0.0,0.0,0.0,0.0,0.0
ธนาคารกลาง,0,0,0,0,0,0,0,0,0,0,0,0,0,0.0,0.0,0.0,0.0,0.0,0.0,0.0,0.0,0.0,0.0,0.0,0.0,0.0
ตัวกลางทางการเงินอื่นๆ,0,0,0,0,0,0,0,0,0,0,0,0,0,0.0,0.0,0.0,0.0,0.0,0.0,0.0,0.0,0.0,0.0,0.0,0.0,0.0
ธนาคารพาณิชย์,0,0,0,0,0,0,0,1,1,0,0,0,2,0.0,0.0,0.0,0.0,0.0,0.0,0.0,500.0,50.0,0.0,0.0,0.0,550.0
บริษัทเงินทุน,0,0,0,0,0,0,0,0,0,0,0,0,0,0.0,0.0,0.0,0.0,0.0,0.0,0.0,0.0,0.0,0.0,0.0,0.0,0.0
บริษัทเครดิตฟองซิเอร์,0,0,0,0,0,0,0,0,0,0,0,0,0,0.0,0.0,0.0,0.0,0.0,0.0,0.0,0.0,0.0,0.0,0.0,0.0,0.0
ธนาคารเฉพาะกิจ,0,0,0,0,0,0,0,0,0,0,0,0,0,0.0,0.0,0.0,0.0,0.0,0.0,0.0,0.0,0.0,0.0,0.0,0.0,0.0
สหกรณ์ที่เป็นตัวกลางทางการเงิน,0,0,0,0,0,0,0,0,0,0,0,1,1,0.0,0.0,0.0,0.0,0.0,0.0,0.0,0.0,0.0,0.0,0.0,4.5,4.5
กิจกรรมของบริษัทโฮลดิ้งที่ลงทุนในธุรกิจการเงินเป็นหลัก,4,3,3,10,7,6,4,5,7,8,12,10,79,6.0,8.0,4.0,21.11,10.103,16.0,4.0,7.5,270.0,16.6,17.1,9.02,389.433
กิจกรรมของบริษัทโฮลดิ้งที่ไม่ได้ลงทุนในธุรกิจการเงินเป็นหลัก,69,59,58,57,63,79,77,66,71,61,55,60,775,430.82,532.4902,433.61,15450.210893,295.25405,300.147,1613.98562,3776.9599,1830.128704,587.5179,158.5253,2038.34266,27447.992226999995
กองทุน,0,0,0,0,0,0,0,0,0,0,0,0,0,0.0,0.0,0.0,0.0,0.0,0.0,0.0,0.0,0.0,0.0,0.0,0.0,0.0
ทรัสต์,0,0,1,0,0,0,0,0,0,0,0,0,1,0.0,0.0,20.0,0.0,0.0,0.0,0.0,0.0,0.0,0.0,0.0,0.0,20.0
กิจกรรมทางการเงินอื่นๆซึ่งมิได้จัดประเภทไว้ในที่อื่น,0,2,0,0,1,0,1,0,0,1,0,0,5,0.0,11.0,0.0,0.0,5.0,0.0,1.0,0.0,0.0,1.0,0.0,0.0,18.0
สัญญาเช่าทางการเงินสำหรับยานยนต์,0,1,0,1,2,1,1,2,1,0,0,0,9,0.0,1.0,0.0,1.0,10.0,1.0,5.0,6.0,1.0,0.0,0.0,0.0,25.0
สัญญาเช่าทางการเงินสำหรับเครื่องจักรและอุปกรณ์เพื่อ การดำเนินธุรกิจ,0,0,0,0,0,0,0,0,0,0,0,0,0,0.0,0.0,0.0,0.0,0.0,0.0,0.0,0.0,0.0,0.0,0.0,0.0,0.0
สัญญาเช่าทางการเงินสำหรับสินค้าอุปโภค (ยกเว้นยานยนต์และ จักรยานยนต์),0,0,0,0,0,0,1,0,0,1,0,0,2,0.0,0.0,0.0,0.0,0.0,0.0,2.0,0.0,0.0,1.0,0.0,0.0,3.0
การให้สินเชื่อประเภทอื่นๆ,0,0,0,0,0,0,0,0,0,0,0,0,0,0.0,0.0,0.0,0.0,0.0,0.0,0.0,0.0,0.0,0.0,0.0,0.0,0.0
การให้สินเชื่อเพื่อการค้าและการลงทุน,4,0,0,0,2,1,1,1,1,0,1,1,12,20.0,0.0,0.0,0.0,5.0,5.0,2.0,1.0,1.0,0.0,5.0,1.0,40.0
การให้สินเชื่อเพื่อการอุปโภคบริโภค,2,0,0,0,0,3,2,1,1,1,0,1,11,6.0,0.0,0.0,0.0,0.0,2.1,1.6,5.0,5.0,2.0,0.0,5.0,26.7
การให้สินเชื่อเพื่อการซื้อที่อยู่อาศัย,0,0,0,0,0,1,0,0,0,0,0,0,1,0.0,0.0,0.0,0.0,0.0,5.0,0.0,0.0,0.0,0.0,0.0,0.0,5.0
การให้สินเชื่อบัตรเครดิต,0,0,0,0,0,0,0,0,0,0,0,0,0,0.0,0.0,0.0,0.0,0.0,0.0,0.0,0.0,0.0,0.0,0.0,0.0,0.0
การบริการของโรงรับจำนำ,1,4,0,2,1,1,2,1,3,0,2,1,18,5.0,20.0,0.0,10.0,5.0,4.0,8.0,1.0,6.0,0.0,6.0,3.0,68.0
การให้สินเชื่ออื่นๆซึ่งมิได้จัดประเภทไว้ในที่อื่น,11,12,15,14,9,16,12,23,10,8,8,10,148,82.0,50.2,36.72,78.0,34.0,65.27,55.0,78.86,40.2,34.0,34.5,135.0,723.75
กิจกรรมการให้เงินทุนนอกเหนือจากการให้กู้ยืมเงิน,3,8,1,6,6,2,4,6,2,7,3,0,48,7.5,12.5,5.0,14.0,18.0,5.1,6.5,8.0,2.0,23.0,6.5,0.0,108.1
กิจกรรมการลงทุนที่เป็นกิจกรรมของตนเอง,1,3,2,2,3,3,1,4,5,2,2,5,33,1.0,3.0,6.0,6.0,7.0,5.5,75.0,8.01,17.0,6.0,1.1,8.3,143.91
กิจกรรมบริการทางการเงินอื่นๆ (ยกเว้นกิจกรรมการประกันภัย และกองทุนบำเหน็จบำนาญ) ซึ่งมิได้จัดประเภทไว้ในที่อื่น,2,0,2,1,1,0,0,2,0,1,4,2,15,1.2,0.0,2.0,2.0,5.0,0.0,0.0,2.0,0.0,1.0,19.0,6.0,38.2
การประกันภัย,0,0,0,0,0,0,0,0,0,0,0,0,0,0.0,0.0,0.0,0.0,0.0,0.0,0.0,0.0,0.0,0.0,0.0,0.0,0.0
การประกันชีวิต,0,0,2,0,1,2,2,1,2,1,0,0,11,0.0,0.0,1.2,0.0,0.05,0.11,0.11,1.0,1.01,0.01,0.0,0.0,3.49
การประกันวินาศภัย,0,1,0,0,0,1,0,0,0,0,0,2,4,0.0,1.0,0.0,0.0,0.0,1.0,0.0,0.0,0.0,0.0,0.0,3.2,5.2
การประกันภัยต่อ,0,0,0,0,0,0,0,0,0,0,0,0,0,0.0,0.0,0.0,0.0,0.0,0.0,0.0,0.0,0.0,0.0,0.0,0.0,0.0
กองทุนบำเหน็จบำนาญ (ผลประโยชน์ ตอบแทนเพื่อการเกษียณอายุหรือการชราภาพ),0,0,0,0,0,0,0,0,0,0,0,0,0,0.0,0.0,0.0,0.0,0.0,0.0,0.0,0.0,0.0,0.0,0.0,0.0,0.0
กิจกรรมที่ช่วยเสริมกิจกรรมการบริการทางการเงินยกเว้น การประกันภัยและกองทุนบำเหน็จบำนาญ,0,0,0,0,0,0,0,0,0,0,0,0,0,0.0,0.0,0.0,0.0,0.0,0.0,0.0,0.0,0.0,0.0,0.0,0.0,0.0
การบริหารงานด้านตลาดการเงิน,0,0,0,0,0,0,0,0,0,0,0,0,0,0.0,0.0,0.0,0.0,0.0,0.0,0.0,0.0,0.0,0.0,0.0,0.0,0.0
การบริหารงานตลาดเงินและตลาดทุน,0,0,1,1,1,0,1,1,0,0,1,0,6,0.0,0.0,0.04,2.0,1.0,0.0,5.0,1.0,0.0,0.0,0.04,0.0,9.079999999999998
การบริหารงานตลาดอนุพันธ์,0,0,0,0,0,0,0,0,0,0,0,0,0,0.0,0.0,0.0,0.0,0.0,0.0,0.0,0.0,0.0,0.0,0.0,0.0,0.0
การบริการควบคุมดูแลการบริหารงานตลาดการเงิน,0,0,0,0,0,0,0,0,0,0,0,0,0,0.0,0.0,0.0,0.0,0.0,0.0,0.0,0.0,0.0,0.0,0.0,0.0,0.0
กิจกรรมนายหน้าซื้อขายหลักทรัพย์และตราสารอนุพันธ์,0,0,0,0,0,0,0,0,0,0,0,0,0,0.0,0.0,0.0,0.0,0.0,0.0,0.0,0.0,0.0,0.0,0.0,0.0,0.0
กิจกรรมนายหน้าซื้อขายหลักทรัพย์,1,1,0,2,0,1,0,0,1,0,0,0,6,1.0,0.04,0.0,5.5,0.0,1.0,0.0,0.0,1.0,0.0,0.0,0.0,8.54
กิจกรรมนายหน้าซื้อขายตราสารอนุพันธ์,0,0,0,0,0,0,0,0,0,0,0,0,0,0.0,0.0,0.0,0.0,0.0,0.0,0.0,0.0,0.0,0.0,0.0,0.0,0.0
กิจกรรมเกี่ยวกับแลกเปลี่ยนเงินตราต่างประเทศ,18,18,35,12,20,88,15,18,51,15,14,12,316,49.39,31.5,70.0,19.0,45.6,160.5,28.0,36.5,83.9,27.0,21.4,23.1,595.89
กิจกรรมอื่นๆที่สนับสนุนกิจกรรมบริการทางการเงิน,0,0,0,0,0,0,0,0,0,0,0,0,0,0.0,0.0,0.0,0.0,0.0,0.0,0.0,0.0,0.0,0.0,0.0,0.0,0.0
บริการที่ปรึกษาการลงทุน,8,3,7,6,5,6,2,4,3,4,3,6,57,11.1,9.0,15.1,20.0,17.1,19.5,2.0,6.01,2.1,6.5,15.0,17.1,140.51000000000002
กิจกรรมการประมวลผลและการเรียกชำระเงินสำหรับธุรกรรม ทางการเงิน,3,2,2,2,2,3,3,3,2,1,2,0,25,1.5,101.0,2.0,5.0,1.1,22.35,103.0,4.01,10.0,10.0,11.0,0.0,270.96
บริการดูแลและรักษาหลักทรัพย์,0,0,0,0,0,0,0,0,0,0,0,0,0,0.0,0.0,0.0,0.0,0.0,0.0,0.0,0.0,0.0,0.0,0.0,0.0,0.0
กิจกรรมอื่นๆที่ช่วยเสริมกิจกรรมการให้บริการทางการเงิน ซึ่งมิได้จัดประเภทไว้ในที่อื่น,21,34,30,37,24,33,44,19,39,42,34,18,375,33.615,34.6,40.2,52.21,26.9,38.752,88.003,21.1,109.235005,76.3,68.47,56.65,646.0350050000001
การประเมินความเสี่ยงภัยและมูลค่าความเสียหาย,7,4,7,1,4,5,5,6,5,4,6,2,56,4.5,2.32,6.63,2.0,2.7,4.7,2.9,3.7,3.6,3.1,4.4,1.5,42.05
กิจกรรมของตัวแทนและนายหน้าประกันภัย,0,0,0,0,0,0,0,0,0,0,0,0,0,0.0,0.0,0.0,0.0,0.0,0.0,0.0,0.0,0.0,0.0,0.0,0.0,0.0
กิจกรรมของตัวแทนและนายหน้าประกันชีวิต,3,0,0,1,3,4,0,1,0,0,0,0,12,1.2,0.0,0.0,1.0,1.2,1.4,0.0,1.0,0.0,0.0,0.0,0.0,5.800000000000001
กิจกรรมของตัวแทนและนายหน้าประกันวินาศภัย,0,0,0,1,0,0,0,0,0,0,1,0,2,0.0,0.0,0.0,4.0,0.0,0.0,0.0,0.0,0.0,0.0,1.0,0.0,5.0
กิจกรรมอื่นๆที่สนับสนุนการประกันภัยและกองทุนบำเหน็จ บำนาญ,0,0,0,2,0,0,1,0,0,1,0,0,4,0.0,0.0,0.0,3.0,0.0,0.0,1.0,0.0,0.0,0.5,0.0,0.0,4.5
กิจกรรมการจัดการหลักทรัพย์การลงทุนและกองทุน (ยกเว้น กองทุนบำเหน็จบำนาญ),0,0,1,0,0,0,1,1,0,0,0,0,3,0.0,0.0,4.0,0.0,0.0,0.0,0.1,1.0,0.0,0.0,0.0,0.0,5.1
กิจกรรมเกี่ยวกับอสังหาริมทรัพย์,0,0,0,0,0,0,0,0,0,0,0,0,0,0.0,0.0,0.0,0.0,0.0,0.0,0.0,0.0,0.0,0.0,0.0,0.0,0.0
กิจกรรมเกี่ยวกับอสังหาริมทรัพย์ที่เป็นของตนเองหรือเช่าจาก ผู้อื่น,0,0,0,0,0,0,0,0,0,0,0,0,0,0.0,0.0,0.0,0.0,0.0,0.0,0.0,0.0,0.0,0.0,0.0,0.0,0.0
การซื้อและการขายอสังหาริมทรัพย์ที่เป็นของตนเอง เพื่อการพักอาศัย,159,107,135,103,104,93,104,95,98,109,99,70,1276,574.7,468.7,497.54,367.3,451.5,271.2,475.29,475.6,340.45,346.2,391.8,252.0,4912.28
การซื้อและการขายอสังหาริมทรัพย์ที่เป็นของตนเองที่ไม่ใช่ เพื่อเป็นที่พักอาศัย,304,245,253,218,243,179,179,160,189,118,94,81,2263,1039.5,1272.59,1149.65,773.51,830.98,662.4,1747.4,899.04,1427.906,586.48,1747.741414,1085.475,13222.672414
การเช่าและการดำเนินการเกี่ยวกับอสังหาริมทรัพย์ที่เป็น ของตนเองหรือเช่าจากผู้อื่นเพื่อเป็นที่พักอาศัย,75,70,82,62,53,67,63,56,65,60,38,44,735,183.2,172.2,221.2,181.61,126.9,162.0,182.77,151.0,152.08,336.108,188.9717,183.5,2241.5397
การเช่าและการดำเนินการเกี่ยวกับอสังหาริมทรัพย์ที่เป็นของ ตนเองหรือเช่าจากผู้อื่นที่ไม่ใช่เพื่อเป็นที่พักอาศัย,74,51,53,56,36,48,43,49,56,48,39,38,591,241.55,203.4,241.35,246.425,69.75,236.577,217.968,150.1,125.11,302.85,601.7,129.95,2766.73
กิจกรรมเกี่ยวกับอสังหาริมทรัพย์ที่กระทำโดยได้รับค่าตอบแทน หรือตามสัญญาจ้าง,0,0,0,0,0,0,0,0,0,0,0,0,0,0.0,0.0,0.0,0.0,0.0,0.0,0.0,0.0,0.0,0.0,0.0,0.0,0.0
กิจกรรมของตัวแทนและนายหน้าอสังหาริมทรัพย์โดยได้รับ ค่าตอบแทนหรือตามสัญญาจ้าง,133,112,146,91,116,79,106,109,117,85,82,77,1253,869.45,290.25,393.75,212.7,325.56,211.55,237.71,255.954799,266.5,195.42,169.685,199.9905,3628.520299
กิจกรรมบริการอื่นๆที่เกี่ยวกับอสังหาริมทรัพย์โดยได้รับ ค่าตอบแทนหรือตามสัญญาจ้าง,69,79,55,53,54,45,34,32,27,28,25,10,511,219.0,246.71,166.21,142.52,150.9,127.7,86.85,76.3,44.75,70.7,57.55,25.55,1414.7399999999998
กิจกรรมทางกฎหมายและบัญชี,0,0,0,0,0,0,0,0,0,0,0,0,0,0.0,0.0,0.0,0.0,0.0,0.0,0.0,0.0,0.0,0.0,0.0,0.0,0.0
กิจกรรมทางกฎหมาย,90,96,87,67,73,67,79,65,65,57,29,42,817,99.365,108.38,103.5505,75.475,78.07,67.9,82.1,88.47,75.56,70.75,40.19,64.96011,954.77061
กิจกรรมเกี่ยวกับบัญชีการทำบัญชีและการตรวจสอบบัญชี การให้คำปรึกษาด้านภาษี,131,84,62,41,60,68,93,87,96,59,45,37,863,78.22,55.5655,48.573333,19.515,34.23,56.92,68.784,57.43,66.91,56.02,39.57,37.055,618.792833
กิจกรรมของสำนักงานใหญ่,0,0,0,0,0,0,0,2,0,0,0,1,3,0.0,0.0,0.0,0.0,0.0,0.0,0.0,4.1,0.0,0.0,0.0,2.0,6.1
สำนักงานผู้แทนนิติบุคคลระหว่างประเทศ,1,1,1,0,0,0,0,0,1,0,0,0,4,1.0,5.0,5.0,0.0,0.0,0.0,0.0,0.0,5.0,0.0,0.0,0.0,16.0
สำนักงานภูมิภาคของบริษัทข้ามชาติ,1,0,0,0,0,0,0,0,2,0,0,0,3,0.1,0.0,0.0,0.0,0.0,0.0,0.0,0.0,2.0,0.0,0.0,0.0,2.1
สำนักงานปฏิบัติการภูมิภาค,3,7,4,7,6,9,7,10,4,16,5,1,79,6.01,10.1,3.201,37.2,8.31,15.701,13.351,29.11,6.3,39.0,40.2,1.0,209.483
กิจกรรมการให้คำปรึกษาด้านการบริหารจัดการ,0,0,0,0,0,0,0,0,0,0,0,0,0,0.0,0.0,0.0,0.0,0.0,0.0,0.0,0.0,0.0,0.0,0.0,0.0,0.0
กิจกรรมให้คำปรึกษาด้านการสื่อสารประชาสัมพันธ์,2,3,2,1,2,0,7,1,3,2,1,2,26,2.0,3.0,2.0,1.0,2.0,0.0,12.25,1.0,3.0,1.1,0.1,2.0,29.450000000000003
กิจกรรมให้คำปรึกษาด้านการบริหารจัดการการเงิน,19,12,12,4,9,9,11,12,4,5,4,6,107,40.9,14.75,19.61,12.1,9.589,8.0,18.6,14.7,3.3,4.05,7.5,8.35,161.44899999999998
กิจกรรมให้คำปรึกษาด้านการบริหารจัดการอื่นๆซึ่งมิได้จัด ประเภทไว้ในที่อื่น,221,212,219,154,159,194,159,194,191,158,134,132,2127,462.523,482.9,488.9701,240.8055,241.315,318.611,255.0049,253.86,284.3297,303.735,376.345,265.604999,3974.004199
ตัวแทนธุรกิจการค้าระหว่างประเทศ,0,0,0,0,0,0,0,0,0,0,0,0,0,0.0,0.0,0.0,0.0,0.0,0.0,0.0,0.0,0.0,0.0,0.0,0.0,0.0
กิจกรรมงานสถาปัตยกรรมและวิศวกรรมและการให้คำปรึกษา ทางด้านเทคนิคที่เกี่ยวข้อง,0,0,0,0,0,0,0,0,0,0,0,0,0,0.0,0.0,0.0,0.0,0.0,0.0,0.0,0.0,0.0,0.0,0.0,0.0,0.0
กิจกรรมงานสถาปัตยกรรมและการให้คำปรึกษาที่เกี่ยวข้อง,25,34,34,21,24,25,19,30,32,15,16,10,285,45.2,49.8,62.1,29.5,33.9,35.5,24.87,44.95,40.15,27.5,32.4,13.05,438.92
กิจกรรมงานวิศวกรรมและการให้คำปรึกษาทางด้านเทคนิค ที่เกี่ยวข้อง,68,53,55,49,62,50,44,49,48,38,44,24,584,107.92,111.51,105.911,114.5,110.14,178.27,86.0,79.2,107.4,91.0,88.821,62.2,1242.872
