type,jan_regis,feb_regis,mar_regis,apr_regis,may_regis,jun_regis,jul_regis,aug_regis,sep_regis,oct_regis,nov_regis,dec_regis,total_regis,jan_m,feb_m,mar_m,apr_m,may_m,jun_m,jul_m,aug_m,sep_m,oct_m,nov_m,dec_m,total_m
การผลิตเสื้อผ้าเครื่องแต่งกายที่ใช้ในงานอุตสาหกรรมวิชาชีพนักเรียนและนักศึกษา,5,1,2,0,0,4,3,1,1,4,2,1,24,8.6,1.0,2.0,0.0,0.0,3.5,3.0,1.0,1.0,4.55,3.1,0.2,27.950000000000003
การผลิตเสื้อผ้าชั้นนอก,31,24,31,11,15,18,22,12,22,18,6,3,213,39.76,27.85,29.8,13.0,24.15,23.6,25.75,17.6,24.3,15.1,6.70006,4.0,251.61006
การผลิตชุดชั้นในและชุดนอน,0,0,0,0,0,1,0,0,0,0,0,0,1,0.0,0.0,0.0,0.0,0.0,1.0,0.0,0.0,0.0,0.0,0.0,0.0,1.0
การผลิตเสื้อผ้าสำหรับเด็กทารก,0,1,0,0,0,0,0,0,1,0,0,0,2,0.0,0.5,0.0,0.0,0.0,0.0,0.0,0.0,0.5,0.0,0.0,0.0,1.0
การผลิตชุดกีฬา,5,3,0,0,3,0,3,3,2,1,2,4,26,4.25,6.0,0.0,0.0,3.0,0.0,4.0,2.2,2.0,1.0,4.0,5.4,31.85
การผลิตเสื้อผ้าเครื่องแต่งกายจากหนัง,0,0,0,1,0,0,0,1,1,0,0,0,3,0.0,0.0,0.0,1.0,0.0,0.0,0.0,1.5,1.0,0.0,0.0,0.0,3.5
การตัดเย็บเสื้อผ้าตามคำสั่งของลูกค้า,3,2,6,11,8,5,8,6,8,7,4,5,73,5.0,2.0,7.0,17.0,11.0,7.1,11.8,9.5,12.0,10.25,5.0,5.2,102.85
การผลิตเครื่องปกคลุมหรือสวมศีรษะ,0,0,0,0,0,0,1,0,0,0,0,1,2,0.0,0.0,0.0,0.0,0.0,0.0,2.0,0.0,0.0,0.0,0.0,5.0,7.0
การผลิตเครื่องประกอบเครื่องแต่งกายอื่น ๆ ซึ่งมิได้จัดประเภทไว้ในที่อื่น,1,0,0,1,0,0,1,0,0,0,0,0,3,1.0,0.0,0.0,2.0,0.0,0.0,1.0,0.0,0.0,0.0,0.0,0.0,4.0
การผลิตสิ่งของต่าง ๆ ที่ทำจากขนสัตว์,0,0,0,0,0,0,0,0,0,0,0,0,0,0.0,0.0,0.0,0.0,0.0,0.0,0.0,0.0,0.0,0.0,0.0,0.0,0.0
การผลิตเสื้อผ้าเครื่องแต่งกายด้วยการถักและถักโครเชต์,0,0,0,0,0,0,0,0,0,0,0,0,0,0.0,0.0,0.0,0.0,0.0,0.0,0.0,0.0,0.0,0.0,0.0,0.0,0.0
การผลิตถุงเท้าถุงน่องชุดชั้นในด้วยการถักและถักโครเชต์,0,0,0,0,0,0,2,0,0,0,0,0,2,0.0,0.0,0.0,0.0,0.0,0.0,3.0,0.0,0.0,0.0,0.0,0.0,3.0
การฟอกและการตกแต่งเครื่องหนังการตกแต่งและการย้อมสี หนังขนสัตว์,2,0,0,0,0,0,0,0,0,0,0,0,2,5.0,0.0,0.0,0.0,0.0,0.0,0.0,0.0,0.0,0.0,0.0,0.0,5.0
การผลิตกระเป๋าเดินทางกระเป๋าถือและกระเป๋าอื่นๆที่ คล้ายกันอานและเครื่องลากเทียมสัตว์,0,0,0,0,0,0,0,0,0,0,0,0,0,0.0,0.0,0.0,0.0,0.0,0.0,0.0,0.0,0.0,0.0,0.0,0.0,0.0
การผลิตผลิตภัณฑ์ประเภทกระเป๋า,6,2,5,2,1,0,2,1,1,0,3,0,23,25.5,6.0,9.51,6.0,5.0,0.0,4.0,1.0,2.0,0.0,5.1,0.0,64.11
การผลิตอานเครื่องลากเทียมสัตว์และของเล่นสัตว์,0,0,0,0,0,0,0,0,2,0,0,0,2,0.0,0.0,0.0,0.0,0.0,0.0,0.0,0.0,4.0,0.0,0.0,0.0,4.0
การผลิตสิ่งของอื่นๆที่ทำจากหนังฟอกหรือหนังอัดซึ่งมิได้ จัดประเภทไว้ในที่อื่น,0,0,1,0,0,0,0,0,0,0,0,0,1,0.0,0.0,1.0,0.0,0.0,0.0,0.0,0.0,0.0,0.0,0.0,0.0,1.0
การผลิตรองเท้าหนัง,0,0,0,0,0,0,0,0,0,0,0,0,0,0.0,0.0,0.0,0.0,0.0,0.0,0.0,0.0,0.0,0.0,0.0,0.0,0.0
การผลิตรองเท้ายาง,0,0,0,0,0,0,0,0,0,0,0,0,0,0.0,0.0,0.0,0.0,0.0,0.0,0.0,0.0,0.0,0.0,0.0,0.0,0.0
การผลิตรองเท้าไม้,0,0,0,0,0,0,0,0,0,0,0,0,0,0.0,0.0,0.0,0.0,0.0,0.0,0.0,0.0,0.0,0.0,0.0,0.0,0.0
การผลิตรองเท้ากีฬา,0,0,1,0,0,0,0,0,0,0,0,0,1,0.0,0.0,1.0,0.0,0.0,0.0,0.0,0.0,0.0,0.0,0.0,0.0,1.0
การผลิตรองเท้าอื่น ๆ ซึ่งมิได้จัดประเภทไว้ในที่อื่น,2,4,0,1,1,0,1,1,2,0,1,0,13,2.1,8.0,0.0,2.0,0.1,0.0,1.0,1.0,2.0,0.0,1.0,0.0,17.2
การเลื่อยไม้และการไสไม้,0,0,0,0,0,0,0,0,0,0,0,0,0,0.0,0.0,0.0,0.0,0.0,0.0,0.0,0.0,0.0,0.0,0.0,0.0,0.0
การเลื่อยไม้,1,4,5,6,2,2,2,7,5,5,7,2,48,5.0,13.0,10.0,25.0,3.0,3.0,7.5,10.1,9.5,10.0,11.5,2.5,110.1
การอบและการอัดน้ำยาไม้,0,0,1,0,0,0,0,0,0,0,0,0,1,0.0,0.0,35.0,0.0,0.0,0.0,0.0,0.0,0.0,0.0,0.0,0.0,35.0
การผลิตแผ่นไม้บางและผลิตภัณฑ์ไม้,1,1,3,1,3,0,0,1,0,0,1,3,14,1.0,4.0,12.0,2.0,9.0,0.0,0.0,3.0,0.0,0.0,5.0,5.0,41.0
การผลิตโครงสร้างที่ใช้ในการก่อสร้างและเครื่องประกอบอาคาร,6,1,2,2,1,7,3,4,3,4,0,3,36,10.0,1.0,7.0,4.0,0.5,11.6,3.0,12.0,7.0,5.4,0.0,5.2,66.7
การผลิตภาชนะบรรจุที่ทำจากไม้,2,4,1,2,1,0,1,2,2,2,1,2,20,6.0,9.0,5.0,2.0,1.0,0.0,2.0,5.5,1.2,2.0,4.0,8.0,45.7
การผลิตเครื่องใช้ในบ้านที่ทำจากไม้และไม้ก๊อก,2,1,1,0,0,0,0,0,1,0,2,0,7,10.0,5.0,5.0,0.0,0.0,0.0,0.0,0.0,0.2,0.0,2.0,0.0,22.2
การผลิตผลิตภัณฑ์ที่ทำจากฟางและวัสดุถักสาน,0,0,0,0,0,0,0,0,0,0,0,0,0,0.0,0.0,0.0,0.0,0.0,0.0,0.0,0.0,0.0,0.0,0.0,0.0,0.0
การผลิตผลิตภัณฑ์จากไม้และไม้ก๊อกซึ่งมิได้จัดประเภทไว้ในที่อื่น,2,0,1,0,0,0,0,0,1,2,0,1,7,20.5,0.0,1.0,0.0,0.0,0.0,0.0,0.0,1.0,1.5,0.0,2.0,26.0
การผลิตเยื่อกระดาษ,0,0,0,0,0,0,0,0,0,0,0,0,0,0.0,0.0,0.0,0.0,0.0,0.0,0.0,0.0,0.0,0.0,0.0,0.0,0.0
การผลิตกระดาษและกระดาษแข็ง,0,0,1,1,0,0,2,0,1,1,1,0,7,0.0,0.0,1.0,2.0,0.0,0.0,7.0,0.0,0.5,1.0,4.0,0.0,15.5
การผลิตกระดาษลอนลูกฟูกและกระดาษแข็งลอนลูกฟูกและ การผลิตกล่องจากกระดาษและกระดาษแข็ง,11,7,7,3,8,10,8,6,7,6,4,2,79,44.5,21.0,15.0,13.0,94.8,26.0,24.5,80.5,21.08,14.1,10.0,5.0,369.48
การผลิตผลิตภัณฑ์ที่แปรรูปจากกระดาษเพื่อใช้ในครัวเรือนและ สุขอนามัย,2,2,1,1,1,1,3,0,3,0,2,0,16,1.5,9.0,2.0,2.0,1.0,4.0,3.0,0.0,5.1,0.0,6.0,0.0,33.6
การผลิตอุปกรณ์เครื่องเขียนจากกระดาษ,0,0,0,0,0,1,1,1,0,0,1,0,4,0.0,0.0,0.0,0.0,0.0,1.0,25.0,1.0,0.0,0.0,2.0,0.0,29.0
การผลิตผลิตภัณฑ์แปรรูปอื่น ๆ ที่ทำจากกระดาษและกระดาษแข็ง ซึ่งมิได้จัดประเภทไว้ในที่อื่น,0,0,1,2,1,1,1,1,0,2,1,0,10,0.0,0.0,5.0,7.0,1.0,0.4,0.1,0.02,0.0,10.0,5.0,0.0,28.52
การพิมพ์และการผลิตซ้ำสื่อบันทึก,0,0,0,0,0,0,0,0,0,0,0,0,0,0.0,0.0,0.0,0.0,0.0,0.0,0.0,0.0,0.0,0.0,0.0,0.0,0.0
การพิมพ์และการบริการที่เกี่ยวเนื่องกับการพิมพ์,0,0,0,0,0,0,0,0,0,0,0,0,0,0.0,0.0,0.0,0.0,0.0,0.0,0.0,0.0,0.0,0.0,0.0,0.0,0.0
การพิมพ์,0,0,0,0,0,0,0,0,0,0,0,0,0,0.0,0.0,0.0,0.0,0.0,0.0,0.0,0.0,0.0,0.0,0.0,0.0,0.0
การพิมพ์หนังสือพิมพ์และวารสารอื่น ๆ,0,0,3,1,1,0,0,1,0,0,0,0,6,0.0,0.0,0.6,1.0,1.0,0.0,0.0,0.1,0.0,0.0,0.0,0.0,2.7
การพิมพ์ฉลาก,1,0,2,2,1,2,2,1,3,2,1,0,17,1.0,0.0,1.5,4.1,3.0,0.3,1.1,1.0,2.05,6.0,3.0,0.0,23.05
การพิมพ์อื่น ๆ ซึ่งมิได้จัดประเภทไว้ในที่อื่น,14,8,10,5,14,8,12,4,13,11,8,5,112,19.6,6.6,16.16,13.0,20.0,15.2,49.5,6.0,21.0,15.4,14.14,9.1,205.7
การบริการก่อนการพิมพ์,2,1,1,1,0,0,2,3,0,0,0,0,10,1.3,0.7,1.0,2.0,0.0,0.0,1.5,6.5,0.0,0.0,0.0,0.0,13.0
การบริการอื่น ๆ ที่เกี่ยวเนื่องกับการพิมพ์,0,0,0,0,0,0,0,2,0,0,1,0,3,0.0,0.0,0.0,0.0,0.0,0.0,0.0,4.0,0.0,0.0,2.0,0.0,6.0
การผลิตซ้ำสื่อบันทึก,0,0,0,0,0,0,0,0,0,0,0,0,0,0.0,0.0,0.0,0.0,0.0,0.0,0.0,0.0,0.0,0.0,0.0,0.0,0.0
การผลิตผลิตภัณฑ์ถ่านโค้ก,0,3,0,2,1,1,0,2,0,0,0,0,9,0.0,9.0,0.0,2.0,1.0,2.0,0.0,3.0,0.0,0.0,0.0,0.0,17.0
การผลิตผลิตภัณฑ์ที่ได้จากการกลั่นปิโตรเลียม,0,0,0,0,0,0,0,0,0,0,0,0,0,0.0,0.0,0.0,0.0,0.0,0.0,0.0,0.0,0.0,0.0,0.0,0.0,0.0
การผลิตผลิตภัณฑ์ที่ได้จากโรงกลั่นปิโตรเลียม,0,0,3,1,0,0,0,2,0,0,0,0,6,0.0,0.0,10.1,5.0,0.0,0.0,0.0,6.0,0.0,0.0,0.0,0.0,21.1
การผลิตเชื้อเพลิงชีวภาพ,0,0,0,1,1,0,0,1,0,0,0,0,3,0.0,0.0,0.0,300.0,5.0,0.0,0.0,5.0,0.0,0.0,0.0,0.0,310.0
การผลิตผลิตภัณฑ์อื่น ๆ ที่ได้จากการกลั่นปิโตรเลียมซึ่งมิได้ จัดประเภทไว้ในที่อื่น,2,2,2,2,2,1,1,2,1,1,0,0,16,5.2,2.0,4.0,1581.0,5.0,40.0,60.0,101.0,1.0,5.0,0.0,0.0,1804.2
การผลิตเคมีภัณฑ์ขั้นมูลฐานปุ๋ยเคมีและสารประกอบไนโตรเจน พลาสติกและยางสังเคราะห์ขั้นต้น,0,0,0,0,0,0,0,0,0,0,0,0,0,0.0,0.0,0.0,0.0,0.0,0.0,0.0,0.0,0.0,0.0,0.0,0.0,0.0
การผลิตเคมีภัณฑ์ขั้นมูลฐาน,0,0,0,0,0,0,0,0,0,0,0,0,0,0.0,0.0,0.0,0.0,0.0,0.0,0.0,0.0,0.0,0.0,0.0,0.0,0.0
การผลิตก๊าซที่ใช้ในงานอุตสาหกรรม,0,0,0,0,1,0,0,0,0,0,0,0,1,0.0,0.0,0.0,0.0,4.0,0.0,0.0,0.0,0.0,0.0,0.0,0.0,4.0
การผลิตสีย้อมผ้าและสีผง,1,0,0,0,0,0,0,1,0,0,0,1,3,3.0,0.0,0.0,0.0,0.0,0.0,0.0,1.0,0.0,0.0,0.0,25.0,29.0
การผลิตเคมีภัณฑ์อนินทรีย์ขั้นมูลฐานอื่น ๆ,0,0,0,0,0,0,0,0,1,0,0,0,1,0.0,0.0,0.0,0.0,0.0,0.0,0.0,0.0,10.0,0.0,0.0,0.0,10.0
การผลิตแอลกอฮอล์และเอสเตอร์,0,0,0,1,0,0,0,0,0,0,0,0,1,0.0,0.0,0.0,0.5,0.0,0.0,0.0,0.0,0.0,0.0,0.0,0.0,0.5
การผลิตเคมีภัณฑ์อินทรีย์ขั้นมูลฐานอื่น ๆ,0,0,3,1,1,1,2,4,1,0,2,0,15,0.0,0.0,6.0,5.0,5.0,3.0,6.0,24.15,1.0,0.0,6.0,0.0,56.15
การผลิตปุ๋ยเคมีและปุ๋ยที่มีธาตุไนโตรเจนเป็นสารประกอบ,0,0,0,0,0,0,0,0,0,0,0,0,0,0.0,0.0,0.0,0.0,0.0,0.0,0.0,0.0,0.0,0.0,0.0,0.0,0.0
การผลิตปุ๋ยเคมี,13,6,8,1,5,8,7,5,7,4,2,4,70,24.5,7.9,19.0,1.0,13.0,20.5,8.1,5.5,11.0,3.3,6.0,5.0,124.8
การผลิตสารประกอบไนโตรเจน,0,0,0,0,0,0,1,0,0,0,0,0,1,0.0,0.0,0.0,0.0,0.0,0.0,1.0,0.0,0.0,0.0,0.0,0.0,1.0
การผลิตพลาสติกและยางสังเคราะห์ขั้นต้น,0,0,0,0,0,0,0,0,0,0,0,0,0,0.0,0.0,0.0,0.0,0.0,0.0,0.0,0.0,0.0,0.0,0.0,0.0,0.0
การผลิตเม็ดพลาสติกและพลาสติกขั้นต้น,3,1,1,1,1,4,4,1,7,6,2,3,34,5.0,10.0,1.0,1.5,5.0,21.0,9.0,1.0,17.8,32.5,6.0,7.0,116.8
การผลิตยางสังเคราะห์ขั้นต้น,0,0,0,0,0,1,0,0,0,0,0,0,1,0.0,0.0,0.0,0.0,0.0,1.0,0.0,0.0,0.0,0.0,0.0,0.0,1.0
การผลิตยาปราบศัตรูพืชและเคมีภัณฑ์อื่นๆเพื่อการเกษตร,3,1,1,0,0,1,0,0,1,0,1,4,12,3.0,1.0,1.0,0.0,0.0,2.0,0.0,0.0,0.5,0.0,2.0,3.3,12.8
การผลิตสีน้ำมันชักเงาและสารเคลือบประเภทเดียวกันและ น้ำมันทาไม้,4,2,2,1,1,1,0,0,0,2,1,1,15,21.0,6.0,2.0,3.0,2.0,1.0,0.0,0.0,0.0,2.1,2.0,5.0,44.1
การผลิตหมึกพิมพ์และผงหมึก,1,1,1,0,0,0,0,0,1,0,0,0,4,4.0,4.0,1.0,0.0,0.0,0.0,0.0,0.0,5.0,0.0,0.0,0.0,14.0
การผลิตสบู่และสารซักฟอกผลิตภัณฑ์ทำความสะอาดและ ขัดเงาน้ำหอมและผลิตภัณฑ์ในห้องน้ำ,0,0,0,0,0,0,0,0,0,0,0,0,0,0.0,0.0,0.0,0.0,0.0,0.0,0.0,0.0,0.0,0.0,0.0,0.0,0.0
การผลิตสบู่และสารซักฟอกผลิตภัณฑ์ที่ใช้ในการทำความสะอาด และขัดเงา,3,0,8,3,2,4,4,3,1,4,2,3,37,2.5,0.0,21.0,3.4,6.0,6.21,6.0,7.0,5.0,5.0,6.0,4.0,72.11
การผลิตเครื่องหอม เครื่องสำอาง และผลิตภัณฑ์ในห้องน้ำ,38,32,34,23,27,32,43,22,32,23,24,6,336,171.4,46.0,47.0,40.9,151.9,45.1,58.2,26.8888,43.6,677.9,30.2,8.2,1347.2888
การผลิตผลิตภัณฑ์เคมีชนิดอื่นๆ ซึ่งมิได้จัดประเภทไว้ในที่อื่น,0,0,0,0,0,0,0,0,0,0,0,0,0,0.0,0.0,0.0,0.0,0.0,0.0,0.0,0.0,0.0,0.0,0.0,0.0,0.0
การผลิตผลิตภัณฑ์ที่เกี่ยวกับระเบิด,0,0,0,0,0,0,0,0,0,1,0,0,1,0.0,0.0,0.0,0.0,0.0,0.0,0.0,0.0,0.0,1.0,0.0,0.0,1.0
การผลิตกาวและเจลาติน,4,1,1,1,0,0,0,0,0,0,0,0,7,12.0,35.0,2.0,5.0,0.0,0.0,0.0,0.0,0.0,0.0,0.0,0.0,54.0
การผลิตน้ำมันหอมระเหย,2,0,1,1,0,4,1,0,1,1,0,0,11,2.0,0.0,1.0,2.0,0.0,2.6,1.0,0.0,1.0,2.0,0.0,0.0,11.6
การผลิตเคมีภัณฑ์ที่ใช้ในการถ่ายรูป,0,0,0,0,0,0,0,0,0,0,0,0,0,0.0,0.0,0.0,0.0,0.0,0.0,0.0,0.0,0.0,0.0,0.0,0.0,0.0
การผลิตผลิตภัณฑ์เคมีอื่น ๆ ซึ่งมิได้จัดประเภทไว้ในที่อื่น,8,9,2,8,14,11,5,6,4,8,2,2,79,437.0,20.0,10.0,27.0,73.4,38.0,16.0,13.8,15.1065,21.25,8.0,9.0,688.5564999999999
การผลิตเส้นใยประดิษฐ์,2,0,0,0,0,0,0,1,0,1,0,0,4,210.0,0.0,0.0,0.0,0.0,0.0,0.0,3.0,0.0,2.0,0.0,0.0,215.0
การผลิตเภสัชภัณฑ์และเคมีภัณฑ์ที่ใช้รักษาโรค,3,3,9,0,3,4,4,3,7,2,1,2,41,32.0,7.0,21.98,0.0,7.0,7.0,8.0,7.0,10.05,4.0,1.0,2.0,107.03
การผลิตผลิตภัณฑ์จากพืชและสัตว์ที่ใช้รักษาโรค,12,11,8,5,8,5,12,6,6,6,2,6,87,26.0,17.4,17.0,14.0,12.4,7.0,11.2,6.03,14.0,11.0,5.0,10.0,151.03000000000003
การผลิตยางล้อและยางในรวมถึงการหล่อดอกยางและการซ่อม สร้างยางล้อ,0,0,0,0,0,0,0,0,0,0,0,0,0,0.0,0.0,0.0,0.0,0.0,0.0,0.0,0.0,0.0,0.0,0.0,0.0,0.0
การผลิตยางล้อและยางใน,2,1,2,1,1,0,1,0,0,0,0,0,8,9.0,5.0,15.0,1.0,120.0,0.0,4.0,0.0,0.0,0.0,0.0,0.0,154.0
การหล่อดอกยางและการซ่อมสร้างยางล้อ,0,0,1,0,0,1,1,0,0,0,0,0,3,0.0,0.0,0.5,0.0,0.0,1.0,5.0,0.0,0.0,0.0,0.0,0.0,6.5
การผลิตผลิตภัณฑ์ยางชนิดอื่นๆ,0,0,0,0,0,0,0,0,0,0,0,0,0,0.0,0.0,0.0,0.0,0.0,0.0,0.0,0.0,0.0,0.0,0.0,0.0,0.0
การผลิตยางแผ่นและยางแท่ง,0,0,0,0,0,1,2,0,0,0,0,0,3,0.0,0.0,0.0,0.0,0.0,5.0,6.0,0.0,0.0,0.0,0.0,0.0,11.0
การผลิตน้ำยางข้น,2,0,0,0,0,0,0,0,0,0,0,0,2,61.0,0.0,0.0,0.0,0.0,0.0,0.0,0.0,0.0,0.0,0.0,0.0,61.0
การผลิตสิ่งของเครื่องใช้ด้านสุขอนามัยหรือเภสัชกรรมที่ทำ จากยาง,0,1,2,0,0,0,1,0,0,0,0,0,4,0.0,0.1,6.0,0.0,0.0,0.0,0.5,0.0,0.0,0.0,0.0,0.0,6.6
การผลิตผลิตภัณฑ์ยางอื่น ๆ ซึ่งมิได้จัดประเภทไว้ในที่อื่น,5,6,0,3,4,2,3,4,0,4,2,1,34,9.5,14.0,0.0,12.0,10.1,7.0,31.02,11.0,0.0,4.0,5.0,5.0,108.62
การผลิตผลิตภัณฑ์พลาสติก,0,0,0,0,0,0,0,0,0,0,0,0,0,0.0,0.0,0.0,0.0,0.0,0.0,0.0,0.0,0.0,0.0,0.0,0.0,0.0
การผลิตผลิตภัณฑ์ที่ใช้ในการก่อสร้าง/ประกอบอาคารที่ทำจากพลาสติก,1,1,0,0,0,1,0,1,1,1,0,1,7,1.0,1.0,0.0,0.0,0.0,5.0,0.0,5.0,1.0,2.0,0.0,5.0,20.0
การผลิตบรรจุภัณฑ์พลาสติก,9,14,6,6,7,4,10,11,7,9,11,5,99,205.0,43.5,46.0,12.5,148.5,13.0,74.75,24.0,71.3,25.0,38.5,16.0,718.05
การผลิตผลิตภัณฑ์พลาสติกสำเร็จรูป,3,1,5,1,2,2,4,2,3,1,1,0,25,32.0,1.0,26.0,5.0,21.0,31.0,9.0,1.01,11.0,1.0,4.0,0.0,142.01
การผลิตผลิตภัณฑ์พลาสติกอื่นๆซึ่งมิได้จัดประเภทไว้ในที่อื่น,0,0,0,0,0,0,0,0,0,0,0,0,0,0.0,0.0,0.0,0.0,0.0,0.0,0.0,0.0,0.0,0.0,0.0,0.0,0.0
การผลิตเครื่องใช้บนโต๊ะอาหารในครัวและในห้องน้ำที่ทำจากพลาสติก,1,0,1,0,2,0,0,0,2,1,0,0,7,5.0,0.0,3.0,0.0,11.0,0.0,0.0,0.0,3.5,5.0,0.0,0.0,27.5
การผลิตผลิตภัณฑ์ไฟเบอร์กลาส,1,0,0,0,0,2,0,0,1,0,0,1,5,1.0,0.0,0.0,0.0,0.0,2.0,0.0,0.0,1.0,0.0,0.0,10.0,14.0
การผลิตผลิตภัณฑ์พลาสติกอื่น ๆ ซึ่งมิได้จัดประเภทไว้ในที่อื่น,10,14,16,16,15,15,11,9,5,7,9,10,137,26.1,42.0,290.0,71.55,582.0,141.01,41.5,22.0,19.1,25.4,25.0,56.0,1341.66
การผลิตแก้ว/กระจกแผ่น,1,0,3,0,2,1,2,1,1,1,3,1,16,1.0,0.0,8.9,0.0,51.0,5.0,10.0,0.5,1.0,5.0,8.0,1.0,91.4
การผลิตภาชนะบรรจุภัณฑ์และเครื่องใช้บนโต๊ะอาหารที่ทำจากแก้ว,1,0,0,0,1,0,0,0,0,0,0,1,3,26.4,0.0,0.0,0.0,5.0,0.0,0.0,0.0,0.0,0.0,0.0,3.0,34.4
การผลิตไฟเบอร์กลาส,1,0,0,2,0,0,1,0,0,0,0,1,5,5.0,0.0,0.0,6.0,0.0,0.0,5.0,0.0,0.0,0.0,0.0,0.25,16.25
การผลิตผลิตภัณฑ์แก้วอื่น ๆ ซึ่งมิได้จัดประเภทไว้ในที่อื่น,1,2,0,1,2,1,3,0,0,1,1,1,13,5.0,5.1,0.0,5.0,9.0,1.0,12.0,0.0,0.0,5.0,0.5,2.0,44.6
การผลิตผลิตภัณฑ์วัสดุทนไฟ,0,0,0,0,1,0,0,1,0,0,0,0,2,0.0,0.0,0.0,0.0,4.0,0.0,0.0,1.0,0.0,0.0,0.0,0.0,5.0
การผลิตวัสดุก่อสร้างที่วัตถุดิบหลักทำจากดิน,0,0,0,0,0,0,0,0,0,0,0,0,0,0.0,0.0,0.0,0.0,0.0,0.0,0.0,0.0,0.0,0.0,0.0,0.0,0.0
การผลิตอิฐ,0,3,3,0,2,0,1,1,0,1,0,1,12,0.0,5.5,10.5,0.0,7.0,0.0,0.2,1.0,0.0,5.0,0.0,1.0,30.2
การผลิตกระเบื้องปูพื้นและแผ่นเซรามิก,0,0,2,0,1,0,0,0,0,0,0,0,3,0.0,0.0,6.5,0.0,80.0,0.0,0.0,0.0,0.0,0.0,0.0,0.0,86.5
การผลิตเครื่องสุขภัณฑ์เซรามิก,0,0,0,1,1,2,2,1,0,0,0,0,7,0.0,0.0,0.0,4.0,5.0,45.0,3.0,5.0,0.0,0.0,0.0,0.0,62.0
การผลิตวัสดุที่ใช้ในการก่อสร้างอื่น ๆ ที่ทำจากดินเหนียวซึ่งมิได้ จัดประเภทไว้ในที่อื่น,0,0,0,0,0,0,0,0,0,0,0,0,0,0.0,0.0,0.0,0.0,0.0,0.0,0.0,0.0,0.0,0.0,0.0,0.0,0.0
การผลิตผลิตภัณฑ์เซรามิกที่เป็นเครื่องใช้บนโต๊ะอาหาร,0,1,0,0,0,0,1,0,0,0,0,0,2,0.0,1.0,0.0,0.0,0.0,0.0,1.0,0.0,0.0,0.0,0.0,0.0,2.0
การผลิตผลิตภัณฑ์ประติมากรรมและของตกแต่งที่ทำจากเซรามิก,4,1,5,2,6,2,3,3,2,4,1,0,33,6.5,0.2,22.1,5.0,6.0,2.0,3.2,3.0,2.0,3.2,0.5,0.0,53.7
การผลิตลูกถ้วยฉนวนไฟฟ้าและอุปกรณ์ประกอบลูกถ้วยฉนวนไฟฟ้าที่ทำจากเซรามิก,0,0,0,0,0,0,0,0,0,0,0,0,0,0.0,0.0,0.0,0.0,0.0,0.0,0.0,0.0,0.0,0.0,0.0,0.0,0.0
การผลิตผลิตภัณฑ์เครื่องเคลือบปอร์ซเลนและเซรามิกชนิดอื่น ๆ ซึ่งมิได้จัดประเภทไว้ในที่อื่น,0,1,1,0,0,0,1,0,0,0,0,0,3,0.0,2.0,1.0,0.0,0.0,0.0,5.0,0.0,0.0,0.0,0.0,0.0,8.0
การผลิตปูนซีเมนต์,0,0,1,0,1,0,0,1,0,0,0,0,3,0.0,0.0,1.0,0.0,4.0,0.0,0.0,5.0,0.0,0.0,0.0,0.0,10.0
การผลิตปูนไลม์ (ปูนขาว) และปูนปลาสเตอร์,0,0,0,0,0,0,0,0,0,0,0,0,0,0.0,0.0,0.0,0.0,0.0,0.0,0.0,0.0,0.0,0.0,0.0,0.0,0.0
การผลิตผลิตภัณฑ์คอนกรีตเพื่อใช้ในงานก่อสร้าง,4,7,8,3,3,3,6,6,6,9,8,4,67,9.0,22.0,26.3,10.0,2.4,4.0,108.0,14.0,11.5,32.7,41.5,19.0,300.4
การผลิตผลิตภัณฑ์ปูนปลาสเตอร์ที่ใช้ในงานก่อสร้าง,0,0,0,0,0,0,0,0,0,0,0,0,0,0.0,0.0,0.0,0.0,0.0,0.0,0.0,0.0,0.0,0.0,0.0,0.0,0.0
การผลิตคอนกรีตผสมเสร็จ,3,5,5,2,4,5,1,2,3,3,2,2,37,7.4,14.0,18.0,6.0,14.0,60.3961,1.0,2.0,7.0,8.5,3.0,2.0,143.2961
การผลิตผลิตภัณฑ์ไฟเบอร์ซีเมนต์,0,2,0,0,0,0,0,0,0,0,0,0,2,0.0,4.0,0.0,0.0,0.0,0.0,0.0,0.0,0.0,0.0,0.0,0.0,4.0
การผลิตผลิตภัณฑ์อื่น ๆ ที่ทำจากคอนกรีตซีเมนต์และ ปูนปลาสเตอร์ซึ่งมิได้จัดประเภทไว้ในที่อื่น,1,1,1,1,0,0,0,1,0,0,0,0,5,0.5,1.0,1.0,1.0,0.0,0.0,0.0,1.0,0.0,0.0,0.0,0.0,4.5
การตัดการขึ้นรูปและการแต่งสำเร็จหิน,0,0,0,0,0,0,0,0,0,0,0,0,0,0.0,0.0,0.0,0.0,0.0,0.0,0.0,0.0,0.0,0.0,0.0,0.0,0.0
การผลิตผลิตภัณฑ์หินที่ใช้ในการก่อสร้าง,0,0,0,0,0,2,0,0,0,0,0,0,2,0.0,0.0,0.0,0.0,0.0,5.0,0.0,0.0,0.0,0.0,0.0,0.0,5.0
การผลิตผลิตภัณฑ์อื่น ๆ ที่ทำจากหินซึ่งมิได้จัดประเภทไว้ในที่อื่น,0,0,0,0,0,0,0,0,1,0,0,0,1,0.0,0.0,0.0,0.0,0.0,0.0,0.0,0.0,5.0,0.0,0.0,0.0,5.0
การผลิตผลิตภัณฑ์ขัดถู,1,1,0,0,0,0,0,1,0,1,0,0,4,1.0,2.0,0.0,0.0,0.0,0.0,0.0,5.0,0.0,3.0,0.0,0.0,11.0
การผลิตวัสดุที่เป็นฉนวนจากแร่,1,1,1,1,0,0,0,0,1,1,1,1,8,1.0,5.0,45.0,4.0,0.0,0.0,0.0,0.0,1.0,2.0,4.0,5.0,67.0
การผลิตผลิตภัณฑ์อื่นๆที่ทำจากแร่อโลหะซึ่งมิได้จัดประเภทไว้ในที่อื่น,0,1,0,1,0,0,0,1,1,1,1,1,7,0.0,2.0,0.0,0.25,0.0,0.0,0.0,5.0,5.0,0.6,4.0,1.0,17.85
การผลิตเหล็กและเหล็กกล้าขั้นมูลฐาน,0,0,0,0,0,0,0,0,0,0,0,0,0,0.0,0.0,0.0,0.0,0.0,0.0,0.0,0.0,0.0,0.0,0.0,0.0,0.0
การผลิตเหล็กและเหล็กกล้าขั้นมูลฐานขั้นต้นและขั้นกลาง,0,0,0,0,1,1,0,1,2,1,0,1,7,0.0,0.0,0.0,0.0,5.0,4.0,0.0,5.0,6.0,0.5,0.0,1.0,21.5
การผลิตเหล็กและเหล็กกล้าแผ่น,2,0,1,2,1,0,1,1,0,2,2,0,12,4.0,0.0,5.0,5.0,5.0,0.0,5.0,0.4,0.0,4.0,6.0,0.0,34.4
