type,jan_regis,feb_regis,mar_regis,apr_regis,may_regis,jun_regis,jul_regis,aug_regis,sep_regis,oct_regis,nov_regis,dec_regis,total_regis,jan_m,feb_m,mar_m,apr_m,may_m,jun_m,jul_m,aug_m,sep_m,oct_m,nov_m,dec_m,total_m
การปลูกพืชล้มลุก,0,0,0,0,0,0,0,0,0,0,0,0,0,0.0,0.0,0.0,0.0,0.0,0.0,0.0,0.0,0.0,0.0,0.0,0.0,0.0
การปลูกธัญพืช (ยกเว้นข้าว) พืชตระกูลถั่วและพืชน้ำมัน,0,0,0,0,0,0,0,0,0,0,0,0,0,0.0,0.0,0.0,0.0,0.0,0.0,0.0,0.0,0.0,0.0,0.0,0.0,0.0
การปลูกข้าวโพดที่ใช้เมล็ดแก่,0,0,0,0,0,0,0,0,0,0,0,0,0,0.0,0.0,0.0,0.0,0.0,0.0,0.0,0.0,0.0,0.0,0.0,0.0,0.0
การปลูกธัญพืช (ยกเว้นข้าวและข้าวโพด),0,0,0,0,0,0,0,0,0,0,0,0,0,0.0,0.0,0.0,0.0,0.0,0.0,0.0,0.0,0.0,0.0,0.0,0.0,0.0
การปลูกพืชตระกูลถั่ว,0,0,0,0,0,0,0,0,0,0,0,0,0,0.0,0.0,0.0,0.0,0.0,0.0,0.0,0.0,0.0,0.0,0.0,0.0,0.0
การปลูกถั่วเหลือง,0,0,0,0,0,0,0,0,0,0,0,0,0,0.0,0.0,0.0,0.0,0.0,0.0,0.0,0.0,0.0,0.0,0.0,0.0,0.0
การปลูกพืชน้ำมัน (ยกเว้นถั่วเหลือง),0,0,0,0,0,0,0,0,0,0,0,0,0,0.0,0.0,0.0,0.0,0.0,0.0,0.0,0.0,0.0,0.0,0.0,0.0,0.0
การปลูกข้าวจ้าว,2,1,4,3,1,5,1,5,1,1,1,2,27,1.2,5.0,4.55,2.1,5.0,24.2,1.0,5.0,1.0,2.0,0.15,1.1,52.3
การปลูกข้าวเหนียว,0,0,0,0,0,0,0,0,0,0,1,1,2,0.0,0.0,0.0,0.0,0.0,0.0,0.0,0.0,0.0,0.0,0.15,0.1,0.25
การปลูกพืชผักกินใบและพืชผักกินต้น รวมถึงการเพาะเมล็ดพันธุ์ผัก,4,1,2,0,1,1,0,1,1,0,1,1,13,3.4,1.0,2.0,0.0,1.0,1.0,0.0,1.0,1.0,0.0,1.0,1.0,12.4
การปลูกพืชผักกินผลรวมถึงแตงชนิดต่าง ๆ รวมถึงการเพาะเมล็ดพันธุ์ผัก,0,1,0,0,0,0,0,0,0,1,0,0,2,0.0,2.0,0.0,0.0,0.0,0.0,0.0,0.0,0.0,2.0,0.0,0.0,4.0
การปลูกพืชผักกินหัว,0,0,0,1,1,0,0,0,0,0,0,0,2,0.0,0.0,0.0,0.5,0.5,0.0,0.0,0.0,0.0,0.0,0.0,0.0,1.0
การปลูกพืชจำพวกรากและหัว (ยกเว้นมันสำปะหลัง),0,0,0,0,0,0,0,0,0,0,0,0,0,0.0,0.0,0.0,0.0,0.0,0.0,0.0,0.0,0.0,0.0,0.0,0.0,0.0
การปลูกมันสำปะหลัง,0,0,0,0,0,0,0,0,0,0,0,0,0,0.0,0.0,0.0,0.0,0.0,0.0,0.0,0.0,0.0,0.0,0.0,0.0,0.0
การเพาะเห็ด,2,1,0,0,1,0,0,1,0,0,1,0,6,3.0,0.5,0.0,0.0,1.0,0.0,0.0,1.0,0.0,0.0,1.0,0.0,6.5
การปลูกพืชผักอื่นๆ ซึ่งมิได้จัดประเภทไว้ในที่อื่น,3,6,4,1,1,5,1,4,4,5,2,0,36,4.0,8.1009,9.0,2.0,0.5,10.5,0.12,8.0,1.4,7.0,2.0,0.0,52.62089999999999
การปลูกอ้อย,1,0,0,0,0,0,0,0,0,0,1,0,2,1.0,0.0,0.0,0.0,0.0,0.0,0.0,0.0,0.0,0.0,5.0,0.0,6.0
การปลูกยาสูบ,0,0,0,0,0,0,0,0,0,0,0,0,0,0.0,0.0,0.0,0.0,0.0,0.0,0.0,0.0,0.0,0.0,0.0,0.0,0.0
การปลูกฝ้าย,0,0,0,0,0,0,0,0,0,0,0,0,0,0.0,0.0,0.0,0.0,0.0,0.0,0.0,0.0,0.0,0.0,0.0,0.0,0.0
การปลูกพืชเส้นใยอื่นๆ ซึ่งมิได้จัดประเภทไว้ในที่อื่น,0,0,0,0,0,0,0,0,0,0,0,0,0,0.0,0.0,0.0,0.0,0.0,0.0,0.0,0.0,0.0,0.0,0.0,0.0,0.0
การปลูกข้าวโพดเลี้ยงสัตว์,0,0,0,0,0,0,0,0,0,0,0,0,0,0.0,0.0,0.0,0.0,0.0,0.0,0.0,0.0,0.0,0.0,0.0,0.0,0.0
การปลูกพืชล้มลุกที่ใช้เป็นอาหารสัตว์ (ยกเว้นข้าวโพด เลี้ยงสัตว์),0,0,0,0,0,0,0,0,0,0,0,0,0,0.0,0.0,0.0,0.0,0.0,0.0,0.0,0.0,0.0,0.0,0.0,0.0,0.0
การปลูกกล้วยไม้,0,0,0,0,0,0,0,1,0,0,0,0,1,0.0,0.0,0.0,0.0,0.0,0.0,0.0,2.0,0.0,0.0,0.0,0.0,2.0
การปลูกไม้ดอกอื่นๆ (ยกเว้นกล้วยไม้),0,0,0,0,0,0,0,0,0,0,1,0,1,0.0,0.0,0.0,0.0,0.0,0.0,0.0,0.0,0.0,0.0,0.1,0.0,0.1
การปลูกพืชล้มลุกชนิดอื่นๆ ซึ่งมิได้จัดประเภทไว้ในที่อื่น,1,0,0,0,0,0,0,0,0,0,0,0,1,1.0,0.0,0.0,0.0,0.0,0.0,0.0,0.0,0.0,0.0,0.0,0.0,1.0
การทำสวนองุ่น,0,0,0,0,0,0,0,0,0,0,0,0,0,0.0,0.0,0.0,0.0,0.0,0.0,0.0,0.0,0.0,0.0,0.0,0.0,0.0
การปลูกสับปะรด,0,0,0,0,0,0,0,0,0,0,0,0,0,0.0,0.0,0.0,0.0,0.0,0.0,0.0,0.0,0.0,0.0,0.0,0.0,0.0
การปลูกทุเรียน,0,0,0,2,0,0,1,0,1,0,2,0,6,0.0,0.0,0.0,3.0,0.0,0.0,0.4,0.0,1.0,0.0,2.0,0.0,6.4
การปลูกลำไย,0,0,0,0,0,0,0,0,0,0,0,0,0,0.0,0.0,0.0,0.0,0.0,0.0,0.0,0.0,0.0,0.0,0.0,0.0,0.0
การปลูกมะม่วง,0,0,0,0,0,0,0,0,0,0,0,0,0,0.0,0.0,0.0,0.0,0.0,0.0,0.0,0.0,0.0,0.0,0.0,0.0,0.0
การปลูกกล้วย,0,0,0,0,0,0,0,0,0,0,0,0,0,0.0,0.0,0.0,0.0,0.0,0.0,0.0,0.0,0.0,0.0,0.0,0.0,0.0
การปลูกมังคุด,0,0,0,0,0,0,0,0,0,0,0,0,0,0.0,0.0,0.0,0.0,0.0,0.0,0.0,0.0,0.0,0.0,0.0,0.0,0.0
การปลูกเงาะ,0,0,0,0,0,0,0,0,0,0,0,0,0,0.0,0.0,0.0,0.0,0.0,0.0,0.0,0.0,0.0,0.0,0.0,0.0,0.0
การปลูกไม้ผลเมืองร้อนและกึ่งร้อนอื่นๆซึ่งมิได้จัดประเภท ไว้ในที่อื่น,0,0,0,0,0,0,0,0,0,0,0,0,0,0.0,0.0,0.0,0.0,0.0,0.0,0.0,0.0,0.0,0.0,0.0,0.0,0.0
การปลูกส้ม,0,0,0,0,0,0,0,0,0,0,0,0,0,0.0,0.0,0.0,0.0,0.0,0.0,0.0,0.0,0.0,0.0,0.0,0.0,0.0
การปลูกไม้ผลตระกูลส้มอื่นๆซึ่งมิได้จัดประเภทไว้ในที่อื่น,0,0,0,0,0,0,0,0,0,1,0,0,1,0.0,0.0,0.0,0.0,0.0,0.0,0.0,0.0,0.0,0.2,0.0,0.0,0.2
การปลูกไม้ผลเมืองหนาวอื่นๆ ซึ่งมิได้จัดประเภทไว้ในที่อื่น,0,0,0,0,0,0,0,0,0,0,0,0,0,0.0,0.0,0.0,0.0,0.0,0.0,0.0,0.0,0.0,0.0,0.0,0.0,0.0
การปลูกไม้ผลเปลือกแข็งที่กินได้,1,0,0,0,0,0,0,0,0,0,0,0,1,1.0,0.0,0.0,0.0,0.0,0.0,0.0,0.0,0.0,0.0,0.0,0.0,1.0
การปลูกไม้ผลที่มีต้นเป็นพุ่ม,0,0,0,0,0,0,0,0,0,0,0,0,0,0.0,0.0,0.0,0.0,0.0,0.0,0.0,0.0,0.0,0.0,0.0,0.0,0.0
การปลูกไม้ผลยืนต้นอื่นๆซึ่งมิได้จัดประเภทไว้ในทื่อื่น,0,0,1,1,0,2,0,0,0,0,0,0,4,0.0,0.0,3.0,1.0,0.0,102.0,0.0,0.0,0.0,0.0,0.0,0.0,106.0
การปลูกปาล์มน้ำมัน,0,1,0,0,1,0,1,0,1,1,0,0,5,0.0,30.0,0.0,0.0,1.0,0.0,1.0,0.0,1.0,1.0,0.0,0.0,34.0
การปลูกมะพร้าว,1,0,0,1,0,0,0,0,0,0,0,1,3,10.0,0.0,0.0,1.0,0.0,0.0,0.0,0.0,0.0,0.0,0.0,1.0,12.0
การปลูกไม้ยืนต้นอื่นๆที่ให้น้ำมันซึ่งมิได้จัดประเภทไว้ในที่อื่น,0,0,0,0,0,0,0,0,0,0,0,0,0,0.0,0.0,0.0,0.0,0.0,0.0,0.0,0.0,0.0,0.0,0.0,0.0,0.0
การทำไร่ชา,0,0,0,0,0,0,1,0,0,0,0,0,1,0.0,0.0,0.0,0.0,0.0,0.0,1.0,0.0,0.0,0.0,0.0,0.0,1.0
การทำไร่กาแฟ,0,0,0,0,0,0,0,0,0,0,0,0,0,0.0,0.0,0.0,0.0,0.0,0.0,0.0,0.0,0.0,0.0,0.0,0.0,0.0
การปลูกพืชอื่นๆที่นำไปทำเครื่องดื่มซึ่งมิได้จัดประเภทไว้ในที่อื่น,0,0,0,0,0,0,0,0,0,0,0,0,0,0.0,0.0,0.0,0.0,0.0,0.0,0.0,0.0,0.0,0.0,0.0,0.0,0.0
การปลูกพืชประเภทเครื่องเทศเครื่องหอมยารักษาโรคและพืชทางเภสัชภัณฑ์,0,0,0,0,0,0,0,0,0,0,0,0,0,0.0,0.0,0.0,0.0,0.0,0.0,0.0,0.0,0.0,0.0,0.0,0.0,0.0
การปลูกพริก,0,0,0,0,0,0,0,0,0,0,0,0,0,0.0,0.0,0.0,0.0,0.0,0.0,0.0,0.0,0.0,0.0,0.0,0.0,0.0
การปลูกพริกไทย,0,0,0,0,0,0,0,0,0,0,0,0,0,0.0,0.0,0.0,0.0,0.0,0.0,0.0,0.0,0.0,0.0,0.0,0.0,0.0
การปลูกพืชอื่นๆประเภทเครื่องเทศเครื่องหอมยารักษาโรค และพืชทางเภสัชภัณฑ์ซึ่งมิได้จัดประเภทไว้ในที่อื่น,20,5,4,7,4,6,6,8,8,8,7,5,88,47.7,14.0,5.0,18.0,5.0,18.1,9.91,19.5,19.3,6.7,22.0,13.0,198.21
การปลูกต้นยางพารา,1,0,0,0,0,0,0,0,0,2,0,0,3,1.0,0.0,0.0,0.0,0.0,0.0,0.0,0.0,0.0,5.02,0.0,0.0,6.02
การปลูกพืชที่ใช้ในการถักสาน,0,0,0,0,0,0,0,0,0,0,0,0,0,0.0,0.0,0.0,0.0,0.0,0.0,0.0,0.0,0.0,0.0,0.0,0.0,0.0
การปลูกพืชยืนต้นประเภทอื่นๆซึ่งมิได้จัดประเภทไว้ในที่อื่น,1,1,0,0,1,0,0,0,0,0,0,1,4,5.0,0.5,0.0,0.0,1.0,0.0,0.0,0.0,0.0,0.0,0.0,3.0,9.5
การทำสวนไม้ประดับ,0,0,0,0,0,0,0,3,0,2,4,2,11,0.0,0.0,0.0,0.0,0.0,0.0,0.0,6.35,0.0,2.0,6.0,2.0,16.35
การปลูกพืชการเพาะพันธุ์และการขยายพันธุ์พืชอื่นๆ,1,1,0,0,2,0,2,1,2,1,3,0,13,1.0,1.0,0.0,0.0,2.0,0.0,3.0,1.0,5.1,1.0,24.0,0.0,38.1
การเลี้ยงโคและกระบือ,0,0,0,0,0,0,0,0,0,0,0,0,0,0.0,0.0,0.0,0.0,0.0,0.0,0.0,0.0,0.0,0.0,0.0,0.0,0.0
การเลี้ยงโคนมและโคเนื้อ,0,0,0,0,1,0,0,0,2,1,1,1,6,0.0,0.0,0.0,0.0,3.0,0.0,0.0,0.0,2.0,1.0,5.0,20.0,31.0
การเลี้ยงกระบือนมและกระบือเนื้อ,0,0,0,0,0,0,0,0,0,0,0,0,0,0.0,0.0,0.0,0.0,0.0,0.0,0.0,0.0,0.0,0.0,0.0,0.0,0.0
การเลี้ยงโคและกระบือเพื่อวัตถุประสงค์อื่นๆซึ่งมิได้จัดประเภท ไว้ในที่อื่น,0,0,0,0,1,0,0,0,0,0,0,0,1,0.0,0.0,0.0,0.0,1.0,0.0,0.0,0.0,0.0,0.0,0.0,0.0,1.0
การเลี้ยงม้าลาล่อม้าล่อและสัตว์อื่นๆที่คล้ายม้า,0,0,0,0,0,0,0,0,0,0,0,0,0,0.0,0.0,0.0,0.0,0.0,0.0,0.0,0.0,0.0,0.0,0.0,0.0,0.0
การเลี้ยงอูฐที่มีโหนกเดียวและอูฐที่มีสองโหนก,0,0,0,0,0,0,0,0,0,0,0,0,0,0.0,0.0,0.0,0.0,0.0,0.0,0.0,0.0,0.0,0.0,0.0,0.0,0.0
การเลี้ยงแกะ,0,0,0,0,0,0,0,0,0,0,0,0,0,0.0,0.0,0.0,0.0,0.0,0.0,0.0,0.0,0.0,0.0,0.0,0.0,0.0
การเลี้ยงแพะ,0,0,0,1,0,0,0,1,0,0,1,0,3,0.0,0.0,0.0,1.0,0.0,0.0,0.0,2.0,0.0,0.0,0.025,0.0,3.025
การเลี้ยงสุกร,3,5,6,2,5,4,9,5,4,11,7,8,69,6.8,5.2,5.5,6.0,8.0,68.0,21.0,13.0,12.0,31.5,14.0,9.5,200.5
การเลี้ยงสัตว์ปีก,0,0,0,0,0,0,0,0,0,0,0,0,0,0.0,0.0,0.0,0.0,0.0,0.0,0.0,0.0,0.0,0.0,0.0,0.0,0.0
การเลี้ยงไก่ไข่,2,9,1,3,3,2,5,3,4,4,3,0,39,2.0,29.0,1.0,6.0,4.0,6.0,13.0,13.0,9.0,15.0,5.6,0.0,103.6
การเลี้ยงไก่เนื้อ,8,2,6,2,1,4,6,4,2,3,3,4,45,16.0,2.0,10.0,6.0,1.0,5.0,6.0,7.0,4.0,3.0,3.5,8.08,71.58
การเลี้ยงเป็ด,0,0,0,0,0,0,0,0,0,0,0,0,0,0.0,0.0,0.0,0.0,0.0,0.0,0.0,0.0,0.0,0.0,0.0,0.0,0.0
การเลี้ยงสัตว์ปีกอื่นๆ ซึ่งมิได้จัดประเภทไว้ในที่อื่น,0,0,1,0,1,1,0,4,0,2,2,4,15,0.0,0.0,5.0,0.0,1.0,2.0,0.0,11.9,0.0,2.0,1.2,8.1,31.2
การเลี้ยงสัตว์ประเภทอื่นๆ,0,0,0,0,0,0,0,0,0,0,0,0,0,0.0,0.0,0.0,0.0,0.0,0.0,0.0,0.0,0.0,0.0,0.0,0.0,0.0
การเลี้ยงนกกระจอกเทศและนกอีมู,0,0,0,0,0,0,0,0,0,0,0,0,0,0.0,0.0,0.0,0.0,0.0,0.0,0.0,0.0,0.0,0.0,0.0,0.0,0.0
การเลี้ยงไหมผีเสื้อและแมลง,1,0,0,0,0,0,0,0,0,0,0,0,1,0.1,0.0,0.0,0.0,0.0,0.0,0.0,0.0,0.0,0.0,0.0,0.0,0.1
การเลี้ยงผึ้ง,0,0,0,0,0,0,1,0,2,0,0,0,3,0.0,0.0,0.0,0.0,0.0,0.0,1.0,0.0,3.0,0.0,0.0,0.0,4.0
การเลี้ยงนกนางแอ่น,0,0,0,0,0,0,0,0,1,0,0,1,2,0.0,0.0,0.0,0.0,0.0,0.0,0.0,0.0,1.0,0.0,0.0,1.0,2.0
การทำฟาร์มงู,0,0,0,0,0,0,0,0,0,0,0,0,0,0.0,0.0,0.0,0.0,0.0,0.0,0.0,0.0,0.0,0.0,0.0,0.0,0.0
การทำฟาร์มสัตว์เลี้ยง (ยกเว้นสัตว์น้ำ),3,0,0,0,2,0,0,0,0,0,0,0,5,7.0,0.0,0.0,0.0,2.0,0.0,0.0,0.0,0.0,0.0,0.0,0.0,9.0
การเลี้ยงสัตว์ประเภทอื่นๆ ซึ่งมิได้จัดประเภทไว้ในที่อื่น,7,3,6,8,11,11,14,8,11,12,1,0,92,13.05,1.8,14.25,6.65,17.502,20.01,22.505,15.6,17.05,28.602,0.5,0.0,157.519
การทำฟาร์มผสมผสาน,4,1,3,0,0,3,1,2,0,1,2,1,18,4.0,1.0,2.7,0.0,0.0,5.2,1.0,1.5,0.0,2.0,1.5,5.0,23.9
กิจกรรมสนับสนุนการเกษตรและกิจกรรมหลังการเก็บเกี่ยว,0,0,0,0,0,0,0,0,0,0,0,0,0,0.0,0.0,0.0,0.0,0.0,0.0,0.0,0.0,0.0,0.0,0.0,0.0,0.0
การควบคุมแมลงและสัตว์ศัตรูพืช,1,0,0,0,0,1,1,1,1,0,0,1,6,1.0,0.0,0.0,0.0,0.0,1.0,1.0,0.1,1.0,0.0,0.0,1.0,5.1
การดำเนินการเกี่ยวกับอุปกรณ์การให้น้ำและเครื่องมือชลประทาน ทางการเกษตร,0,0,0,1,1,0,0,1,0,0,0,1,4,0.0,0.0,0.0,1.0,1.0,0.0,0.0,1.0,0.0,0.0,0.0,3.0,6.0
กิจกรรมสนับสนุนการผลิตพืชผลซึ่งมิได้จัดประเภทไว้ในที่อื่น,5,3,1,1,0,1,1,4,1,1,4,1,23,9.0,4.0,1.0,0.05,0.0,1.0,1.0,9.0,0.5,5.0,5.5,1.0,37.05
กิจกรรมสนับสนุนการแพร่พันธุ์สัตว์,0,0,0,0,0,0,0,1,0,0,0,0,1,0.0,0.0,0.0,0.0,0.0,0.0,0.0,2.0,0.0,0.0,0.0,0.0,2.0
กิจกรรมสนับสนุนการเลี้ยงสัตว์อื่นๆซึ่งมิได้จัดประเภทไว้ในที่อื่น,1,1,0,1,0,1,1,0,0,1,0,0,6,0.1,1.0,0.0,1.0,0.0,5.0,0.2,0.0,0.0,1.0,0.0,0.0,8.3
กิจกรรมหลังการเก็บเกี่ยวพืชผล,1,0,0,2,1,2,1,0,0,0,0,1,8,5.0,0.0,0.0,7.0,1.0,4.0,1.0,0.0,0.0,0.0,0.0,0.5,18.5
กระบวนการจัดการเมล็ดพันธุ์เพื่อการขยายพันธุ์,0,0,0,0,0,0,0,2,1,1,1,1,6,0.0,0.0,0.0,0.0,0.0,0.0,0.0,6.0,1.0,1.0,1.0,3.0,12.0
การล่าสัตว์การดักสัตว์และกิจกรรมบริการอื่นๆที่เกี่ยวข้อง,0,0,0,0,0,0,0,0,0,0,0,0,0,0.0,0.0,0.0,0.0,0.0,0.0,0.0,0.0,0.0,0.0,0.0,0.0,0.0
วนวัฒนวิทยาและกิจกรรมอื่นๆที่เกี่ยวกับป่าไม้,1,1,0,0,0,3,0,0,0,0,0,1,6,1.0,1.0,0.0,0.0,0.0,2.5,0.0,0.0,0.0,0.0,0.0,1.0,5.5
การทำไม้,3,0,0,0,0,0,0,1,0,2,1,2,9,3.2,0.0,0.0,0.0,0.0,0.0,0.0,0.2,0.0,1.2,4.0,5.0,13.6
การเก็บหาของป่า,0,0,1,0,0,0,0,0,0,0,0,0,1,0.0,0.0,1.0,0.0,0.0,0.0,0.0,0.0,0.0,0.0,0.0,0.0,1.0
บริการสนับสนุนการป่าไม้,0,0,0,1,0,0,0,0,0,0,0,0,1,0.0,0.0,0.0,1.0,0.0,0.0,0.0,0.0,0.0,0.0,0.0,0.0,1.0
การประมงทะเล,0,0,0,0,0,0,0,0,0,0,0,0,0,0.0,0.0,0.0,0.0,0.0,0.0,0.0,0.0,0.0,0.0,0.0,0.0,0.0
การจับปลาทะเล,0,0,0,0,0,0,0,0,0,0,0,0,0,0.0,0.0,0.0,0.0,0.0,0.0,0.0,0.0,0.0,0.0,0.0,0.0,0.0
การจับกุ้งทะเล,0,0,0,0,0,0,0,0,0,0,0,0,0,0.0,0.0,0.0,0.0,0.0,0.0,0.0,0.0,0.0,0.0,0.0,0.0,0.0
การจับปูทะเล,0,0,0,0,0,0,0,0,0,0,0,0,0,0.0,0.0,0.0,0.0,0.0,0.0,0.0,0.0,0.0,0.0,0.0,0.0,0.0
การจับหอยทะเล,0,0,0,0,0,0,0,0,0,0,0,0,0,0.0,0.0,0.0,0.0,0.0,0.0,0.0,0.0,0.0,0.0,0.0,0.0,0.0
การประมงทะเลอื่นๆ ซึ่งมิได้จัดประเภทไว้ในที่อื่น,1,3,0,1,0,0,0,0,0,0,0,0,5,5.0,3.0,0.0,2.0,0.0,0.0,0.0,0.0,0.0,0.0,0.0,0.0,10.0
การจับปลาน้ำจืด,0,0,0,0,0,0,0,0,0,0,0,0,0,0.0,0.0,0.0,0.0,0.0,0.0,0.0,0.0,0.0,0.0,0.0,0.0,0.0
การจับกุ้งน้ำจืด,0,0,0,0,0,0,0,1,0,0,0,0,1,0.0,0.0,0.0,0.0,0.0,0.0,0.0,2.0,0.0,0.0,0.0,0.0,2.0
การประมงน้ำจืดอื่นๆ ซึ่งมิได้จัดประเภทไว้ในที่อื่น,0,1,0,1,0,0,0,0,0,0,0,0,2,0.0,1.0,0.0,1.0,0.0,0.0,0.0,0.0,0.0,0.0,0.0,0.0,2.0
การเพาะเลี้ยงสัตว์น้ำทะเล,0,0,0,0,0,0,0,0,0,0,0,0,0,0.0,0.0,0.0,0.0,0.0,0.0,0.0,0.0,0.0,0.0,0.0,0.0,0.0
การเพาะเลี้ยงปลาทะเล,0,0,0,0,0,0,0,0,0,0,0,0,0,0.0,0.0,0.0,0.0,0.0,0.0,0.0,0.0,0.0,0.0,0.0,0.0,0.0
การเพาะเลี้ยงกุ้งทะเล,0,0,0,0,0,0,0,0,1,1,1,0,3,0.0,0.0,0.0,0.0,0.0,0.0,0.0,0.0,1.0,5.0,1.0,0.0,7.0
การเพาะเลี้ยงหอยทะเล,0,0,0,0,0,0,0,0,0,0,0,0,0,0.0,0.0,0.0,0.0,0.0,0.0,0.0,0.0,0.0,0.0,0.0,0.0,0.0
การเพาะเลี้ยงสัตว์ทะเลสวยงาม,1,0,0,0,0,0,0,0,0,0,0,0,1,0.1,0.0,0.0,0.0,0.0,0.0,0.0,0.0,0.0,0.0,0.0,0.0,0.1
การเพาะเลี้ยงสัตว์น้ำทะเลอื่นๆซึ่งมิได้จัดประเภทไว้ในที่อื่น,0,0,0,0,0,0,0,1,0,0,0,0,1,0.0,0.0,0.0,0.0,0.0,0.0,0.0,1.0,0.0,0.0,0.0,0.0,1.0
การเพาะเลี้ยงปลาน้ำจืด,0,0,1,2,1,1,0,0,1,2,2,0,10,0.0,0.0,5.0,1.35,0.2,1.0,0.0,0.0,0.1,0.2,6.0,0.0,13.85
การเพาะเลี้ยงกุ้งน้ำจืด,0,0,1,0,0,0,0,0,0,2,0,0,3,0.0,0.0,1.0,0.0,0.0,0.0,0.0,0.0,0.0,4.0,0.0,0.0,5.0
การเพาะเลี้ยงกบ,0,0,0,0,0,0,0,0,0,0,0,0,0,0.0,0.0,0.0,0.0,0.0,0.0,0.0,0.0,0.0,0.0,0.0,0.0,0.0
การเพาะเลี้ยงจระเข้,0,0,0,0,0,0,0,0,0,0,0,0,0,0.0,0.0,0.0,0.0,0.0,0.0,0.0,0.0,0.0,0.0,0.0,0.0,0.0
การเพาะเลี้ยงสัตว์น้ำจืดสวยงาม,1,0,0,0,0,0,1,0,2,3,1,1,9,0.1,0.0,0.0,0.0,0.0,0.0,2.0,0.0,3.0,3.0,1.0,1.0,10.1
การเพาะเลี้ยงสัตว์น้ำจืดอื่นๆ ซึ่งมิได้จัดประเภทไว้ในที่อื่น,3,0,2,0,0,0,0,1,0,1,0,0,7,8.0,0.0,3.0,0.0,0.0,0.0,0.0,1.0,0.0,3.0,0.0,0.0,15.0
การทำเหมืองถ่านหินคุณภาพสูง,0,0,0,0,0,0,0,0,0,0,0,0,0,0.0,0.0,0.0,0.0,0.0,0.0,0.0,0.0,0.0,0.0,0.0,0.0,0.0
การทำเหมืองลิกไนต์,0,0,0,0,0,0,0,0,0,0,0,0,0,0.0,0.0,0.0,0.0,0.0,0.0,0.0,0.0,0.0,0.0,0.0,0.0,0.0
การผลิตน้ำมันดิบและก๊าซธรรมชาติ,0,0,0,0,0,0,0,0,0,0,0,0,0,0.0,0.0,0.0,0.0,0.0,0.0,0.0,0.0,0.0,0.0,0.0,0.0,0.0
การผลิตน้ำมันดิบ,0,0,0,0,0,0,0,0,0,0,0,0,0,0.0,0.0,0.0,0.0,0.0,0.0,0.0,0.0,0.0,0.0,0.0,0.0,0.0
การผลิตก๊าซธรรมชาติ,0,0,0,0,0,0,0,0,0,0,0,0,0,0.0,0.0,0.0,0.0,0.0,0.0,0.0,0.0,0.0,0.0,0.0,0.0,0.0
การทำเหมืองสินแร่เหล็ก,0,0,0,0,0,0,0,0,0,0,0,0,0,0.0,0.0,0.0,0.0,0.0,0.0,0.0,0.0,0.0,0.0,0.0,0.0,0.0
การทำเหมืองสินแร่ยูเรเนียมและทอเรียม,0,0,0,0,0,0,0,0,0,0,0,0,0,0.0,0.0,0.0,0.0,0.0,0.0,0.0,0.0,0.0,0.0,0.0,0.0,0.0
การทำเหมืองสินแร่ดีบุก,0,0,0,0,0,1,0,0,0,0,0,1,2,0.0,0.0,0.0,0.0,0.0,10.0,0.0,0.0,0.0,0.0,0.0,1.0,11.0
การทำเหมืองสินแร่สังกะสี,0,0,0,0,0,0,0,0,0,0,0,0,0,0.0,0.0,0.0,0.0,0.0,0.0,0.0,0.0,0.0,0.0,0.0,0.0,0.0
การทำเหมืองสินแร่โลหะนอกกลุ่มสินแร่เหล็กอื่น ๆ ซึ่งมิได้จัด ประเภทไว้ในที่อื่น,0,2,0,1,1,0,0,0,1,1,1,1,8,0.0,3.0,0.0,1.0,5.0,0.0,0.0,0.0,1.0,5.0,5.0,5.0,25.0
การทำเหมืองสินแร่โลหะมีค่า,1,0,0,0,0,0,1,0,0,1,1,1,5,1.0,0.0,0.0,0.0,0.0,0.0,1.0,0.0,0.0,1.0,1.0,1.0,5.0
การทำเหมืองแร่และเหมืองหินอื่นๆ,0,0,0,0,0,0,0,0,0,0,0,0,0,0.0,0.0,0.0,0.0,0.0,0.0,0.0,0.0,0.0,0.0,0.0,0.0,0.0
การทำเหมืองหินที่ใช้ในการก่อสร้าง,0,1,0,3,2,0,0,0,1,2,0,0,9,0.0,1.0,0.0,3.0,3.0,0.0,0.0,0.0,1.0,6.0,0.0,0.0,14.0
การทำเหมืองหินปูนยิปซัมชอล์กและโดโลไมต์,0,0,0,1,0,0,1,0,1,0,0,0,3,0.0,0.0,0.0,4.0,0.0,0.0,2.0,0.0,2.0,0.0,0.0,0.0,8.0
การขุดกรวดและทราย,6,2,4,7,2,4,3,6,5,3,1,2,45,8.0,3.0,7.0,11.3,4.0,10.0,7.0,15.5,26.5,2.5,5.0,9.0,108.8
การทำเหมืองดิน,0,0,0,0,0,0,0,0,0,0,0,0,0,0.0,0.0,0.0,0.0,0.0,0.0,0.0,0.0,0.0,0.0,0.0,0.0,0.0
การทำเหมืองแร่และเหมืองหินซึ่งมิได้จัดประเภทไว้ในที่อื่น,0,0,0,0,0,0,0,0,0,0,0,0,0,0.0,0.0,0.0,0.0,0.0,0.0,0.0,0.0,0.0,0.0,0.0,0.0,0.0
การทำเหมืองแร่ที่ใช้ทำเคมีภัณฑ์และปุ๋ย,0,0,0,0,0,0,0,0,0,0,1,0,1,0.0,0.0,0.0,0.0,0.0,0.0,0.0,0.0,0.0,0.0,2.0,0.0,2.0
การขุดพีต,0,0,0,0,0,0,0,0,0,0,0,0,0,0.0,0.0,0.0,0.0,0.0,0.0,0.0,0.0,0.0,0.0,0.0,0.0,0.0
การทำเหมืองเกลือสินเธาว์,0,0,1,0,0,0,0,0,0,0,0,0,1,0.0,0.0,4.0,0.0,0.0,0.0,0.0,0.0,0.0,0.0,0.0,0.0,4.0
การทำเหมืองเกลือสมุทร,0,0,0,0,0,0,0,0,0,0,0,0,0,0.0,0.0,0.0,0.0,0.0,0.0,0.0,0.0,0.0,0.0,0.0,0.0,0.0
การทำเหมืองแร่ เหมืองแร่อโลหะและเหมืองหินอื่นๆ ซึ่งมิได้จัดประเภทไว้ในที่อื่น,0,0,0,0,0,0,0,0,0,0,0,0,0,0.0,0.0,0.0,0.0,0.0,0.0,0.0,0.0,0.0,0.0,0.0,0.0,0.0
การทำเหมืองแร่รัตนชาติและกึ่งรัตนชาติ,0,0,0,0,0,0,0,0,1,0,0,0,1,0.0,0.0,0.0,0.0,0.0,0.0,0.0,0.0,2.0,0.0,0.0,0.0,2.0
การทำเหมืองแร่ เหมืองแร่อโลหะและเหมืองหินอื่นๆ ซึ่งมิได้จัดประเภทไว้ในที่อื่น,2,2,4,6,9,6,6,9,4,5,3,4,60,2.0,3.0,12.0,22.0,16.75,51.0,17.5,30.0,9.52,15.0,7.0,6.0,191.77
กิจกรรมที่สนับสนุนการขุดเจาะน้ำมันดิบและก๊าซธรรมชาติ,1,0,1,0,0,0,1,0,0,0,0,1,4,5.0,0.0,1.0,0.0,0.0,0.0,1.0,0.0,0.0,0.0,0.0,1.0,8.0
กิจกรรมที่สนับสนุนการทำเหมืองแร่และเหมืองหินอื่นๆ,2,0,0,0,0,0,1,1,0,1,1,0,6,6.0,0.0,0.0,0.0,0.0,0.0,0.2,2.0,0.0,2.0,1.0,0.0,11.2
การฆ่าสัตว์และการบรรจุเนื้อสัตว์ (ยกเว้นสัตว์ปีก),0,0,0,0,0,0,0,0,0,0,0,0,0,0.0,0.0,0.0,0.0,0.0,0.0,0.0,0.0,0.0,0.0,0.0,0.0,0.0
การฆ่าสัตว์ (ยกเว้นสัตว์ปีก),0,1,2,0,1,2,0,0,2,0,2,0,10,0.0,1.0,1.1,0.0,0.5,169.0,0.0,0.0,6.0,0.0,302.0,0.0,479.6
การบรรจุเนื้อสัตว์สด (ยกเว้นสัตว์ปีก),0,0,0,0,0,1,0,1,0,0,0,1,3,0.0,0.0,0.0,0.0,0.0,1.0,0.0,0.5,0.0,0.0,0.0,1.0,2.5
การฆ่าและการบรรจุเนื้อสัตว์ปีกสด,2,0,0,0,1,0,0,0,0,0,0,0,3,6.0,0.0,0.0,0.0,5.0,0.0,0.0,0.0,0.0,0.0,0.0,0.0,11.0
การแปรรูปและการถนอมผลิตภัณฑ์เนื้อสัตว์และเนื้อสัตว์ปีก,0,0,0,0,0,0,0,0,0,0,0,0,0,0.0,0.0,0.0,0.0,0.0,0.0,0.0,0.0,0.0,0.0,0.0,0.0,0.0
การผลิตเนื้อสัตว์และเนื้อสัตว์ปีกด้วยการอบแห้ง การทำเค็มหรือ การรมควัน,3,1,0,0,0,0,0,0,0,2,1,0,7,21.25,2.0,0.0,0.0,0.0,0.0,0.0,0.0,0.0,6.0,1.0,0.0,30.25
การผลิตไส้กรอกลูกชิ้นและผลิตภัณฑ์อื่นที่คล้ายกันที่ทำจาก เนื้อสัตว์และเนื้อสัตว์ปีก,7,8,2,4,2,1,8,3,8,2,3,1,49,11.01,11.7,2.0,2.4,1.3,5.0,9.0,2.0,40.0,3.0,3.4,1.0,91.81
การผลิตเนื้อสัตว์และเนื้อสัตว์ปีกบรรจุกระป๋อง,0,0,0,0,0,0,0,0,0,0,0,0,0,0.0,0.0,0.0,0.0,0.0,0.0,0.0,0.0,0.0,0.0,0.0,0.0,0.0
