type,jan_regis,feb_regis,mar_regis,apr_regis,may_regis,jun_regis,jul_regis,aug_regis,sep_regis,oct_regis,nov_regis,dec_regis,total_regis,jan_m,feb_m,mar_m,apr_m,may_m,jun_m,jul_m,aug_m,sep_m,oct_m,nov_m,dec_m,total_m
การตกแต่งอาคารให้เสร็จสมบูรณ์อื่นๆซึ่งมิได้จัดประเภทไว้ในที่อื่น,6,1,3,3,1,3,3,2,2,6,2,0,32,13.5,0.5,3.0,3.0,4.0,3.0,3.0,2.5,2.0,11.5,1.1,0.0,47.1
การก่อสร้างฐานรากรวมถึงการตอกเสาเข็ม,6,3,4,1,4,1,3,1,4,5,2,0,34,6.0,3.0,4.0,8.0,8.3,5.0,2.8,0.5,5.0,8.5,3.0,0.0,54.1
กิจกรรมการก่อสร้างเฉพาะด้านอื่นๆซึ่งมิได้จัดประเภทไว้ในที่อื่น,8,11,14,10,2,6,5,4,12,7,5,5,89,12.0,16.0,27.0,19.95,2.0,9.0,8.3,4.0,11.2,9.2,4.7,8.5,131.85000000000002
การขายส่งการขายปลีกการซ่อมยานยนต์และจักรยานยนต์,0,0,0,0,0,0,0,0,0,0,0,0,0,0.0,0.0,0.0,0.0,0.0,0.0,0.0,0.0,0.0,0.0,0.0,0.0,0.0
การขายยานยนต์,0,0,0,0,0,0,0,0,0,0,0,0,0,0.0,0.0,0.0,0.0,0.0,0.0,0.0,0.0,0.0,0.0,0.0,0.0,0.0
การขายยานยนต์ใหม่ชนิดรถยนต์นั่งส่วนบุคคลรถกระบะรถตู้ และรถขนาดเล็กที่คล้ายกัน,28,24,20,19,23,35,23,25,34,21,11,15,278,286.5,68.5,108.0,52.0,96.8,166.01,174.6,96.88,178.8,82.93,75.5,46.75,1433.27
การขายยานยนต์ใหม่ชนิดรถบรรทุกและยานยนต์หนักอื่นๆ,4,0,3,2,3,2,2,0,5,3,1,1,26,13.0,0.0,12.0,7.0,8.0,5.0,3.0,0.0,13.0,10.0,1.0,5.0,77.0
การขายยานยนต์เก่าชนิดรถยนต์นั่งส่วนบุคคลรถกระบะรถตู้และรถขนาดเล็กที่คล้ายกัน,46,29,11,8,7,5,7,17,11,10,6,4,161,83.4,59.75,15.0,11.1,20.0,6.5,8.0,26.3,14.0,16.5,14.05,3.5,278.1
การขายยานยนต์เก่าชนิดรถบรรทุกและยานยนต์หนักอื่นๆ,5,2,3,0,1,0,1,0,0,0,0,0,12,5.5,2.0,3.0,0.0,1.0,0.0,4.0,0.0,0.0,0.0,0.0,0.0,15.5
การบำรุงรักษาและการซ่อมยานยนต์,0,0,0,0,0,0,0,0,0,0,0,0,0,0.0,0.0,0.0,0.0,0.0,0.0,0.0,0.0,0.0,0.0,0.0,0.0,0.0
การบำรุงรักษาและการซ่อมระบบเครื่องยนต์และชิ้นส่วนยานยนต์,66,51,40,28,33,46,39,49,57,52,23,33,517,80.25,77.4,60.9,35.75,70.47,52.42,49.05,61.96,70.6,70.21,34.1,43.2,706.3100000000001
การบำรุงรักษาและการซ่อมตัวถังประตูหน้าต่างและอื่นๆที่คล้ายกัน,6,2,9,5,6,14,8,5,10,5,5,2,77,7.5,2.0,17.0,7.0,11.0,17.0,7.0,5.0,13.6,5.0,5.4,2.1,99.6
การบำรุงรักษายานยนต์ทั่วไป,17,13,15,8,8,18,12,16,9,10,12,9,147,18.6,17.6,19.61,9.0,7.7,22.1,22.5,15.98,7.4,18.5,20.05,11.0,190.04
การขายชิ้นส่วนและอุปกรณ์เสริมของยานยนต์,0,0,0,0,0,0,0,0,0,0,0,0,0,0.0,0.0,0.0,0.0,0.0,0.0,0.0,0.0,0.0,0.0,0.0,0.0,0.0
การขายส่งชิ้นส่วนและอุปกรณ์เสริมใหม่ของยานยนต์,29,16,26,26,17,17,21,27,31,25,14,23,272,74.6,31.1,60.4,42.0,35.0,111.81,34.7,48.11,75.95,31.6,11.31,35.5,592.0799999999999
การขายปลีกชิ้นส่วนและอุปกรณ์เสริมใหม่ของยานยนต์,54,40,43,23,31,33,39,48,43,49,14,14,431,70.9,53.7,49.15,31.7,394.8,40.5,78.4,52.9,46.1,71.7,15.7,16.2,921.75
การขายส่งและขายปลีกชิ้นส่วนและอุปกรณ์เสริมเก่าของยานยนต์,7,4,4,2,1,2,9,3,3,7,2,7,51,20.0,7.1,4.3,2.0,1.0,2.0,18.65,6.7,2.3,9.1,5.0,10.94,89.09
การขายการบำรุงรักษาและการซ่อมจักรยานยนต์ชิ้นส่วนและอุปกรณ์เสริมที่เกี่ยวเนื่อง,0,0,0,0,0,0,0,0,0,0,0,0,0,0.0,0.0,0.0,0.0,0.0,0.0,0.0,0.0,0.0,0.0,0.0,0.0,0.0
การขายจักรยานยนต์,17,21,8,8,10,6,14,10,19,14,7,7,141,30.9,34.9,12.5,8.0,20.0,6.6,23.5,17.9,19.65,43.25,13.0,11.5,241.7
การขายส่งชิ้นส่วนและอุปกรณ์เสริมใหม่ของจักรยานยนต์,7,4,1,3,3,1,3,14,7,2,4,1,50,56.0,5.0,1.0,5.5,3.0,1.0,3.5,33.0,106.01,2.0,3.1,2.0,221.11
การขายปลีกชิ้นส่วนและอุปกรณ์เสริมใหม่ของจักรยานยนต์,8,5,7,3,13,5,12,10,9,7,6,4,89,10.0,5.0,14.0,4.0,23.0,5.3,17.3,7.8,6.3,10.5,12.7,8.0,123.9
การขายส่งและปลีกชิ้นส่วนและอุปกรณ์เสริมเก่าของจักรยานยนต์,0,0,0,3,0,0,0,2,1,2,1,2,11,0.0,0.0,0.0,1.5,0.0,0.0,0.0,10.0,0.5,1.2,0.5,1.3,15.0
การบำรุงรักษาและการซ่อมจักรยานยนต์,6,1,3,3,1,4,1,4,5,7,3,4,42,6.0,1.0,2.0,2.3,0.3,4.0,1.0,2.4,4.5,13.0,6.5,5.6,48.6
การขายส่งโดยได้รับค่าตอบแทนหรือตามสัญญาจ้าง,0,0,0,0,0,0,0,0,0,0,0,0,0,0.0,0.0,0.0,0.0,0.0,0.0,0.0,0.0,0.0,0.0,0.0,0.0,0.0
การขายส่งวัตถุดิบทางการเกษตรและสัตว์มีชีวิตโดยได้รับค่าตอบแทนหรือตามสัญญาจ้าง,18,8,6,12,10,11,20,10,13,9,5,13,135,35.55,13.4,8.0,21.5,17.6,15.5,30.78,16.5,33.5,19.1,14.02,21.6,247.05
การขายส่งอาหารเครื่องดื่มและยาสูบโดยได้รับค่าตอบแทนหรือตามสัญญาจ้าง,46,38,37,35,31,34,17,33,25,22,28,20,366,85.61,79.1,173.75,62.72,64.7,55.21,28.7,61.62,41.8,35.6,61.1,32.3,782.2099999999999
การขายส่งสิ่งทอเสื้อผ้ารองเท้าเครื่องหนังและของใช้ในครัวเรือนโดยได้รับค่าตอบแทนหรือตามสัญญาจ้าง,36,31,34,43,35,30,45,39,45,27,26,24,415,77.25,80.5,168.0,106.2,79.48,63.4,89.2,83.5,102.701975,67.8,52.0,43.316,1013.347975
การขายส่งคอมพิวเตอร์และซอฟต์แวร์อุปกรณ์อิเล็กทรอนิกส์และเครื่องมือสื่อสารโดยได้รับค่าตอบแทนหรือตามสัญญาจ้าง,14,12,16,15,10,8,11,22,7,7,16,13,151,22.5,24.0,101.8,35.0,14.3,24.1,146.48,145.5,17.0,9.0,30.0,16.099999,585.7799990000001
การขายส่งเครื่องจักรอุตสาหกรรมโดยได้รับค่าตอบแทนหรือตามสัญญาจ้าง,15,18,16,10,11,19,18,19,20,9,14,11,180,47.1,70.5,36.2,29.0,20.1,31.5,144.0,38.0,40.6,114.0,32.5,35.0,638.5
การขายส่งเชื้อเพลิงสินแร่โลหะโดยได้รับค่าตอบแทนหรือตามสัญญาจ้าง,4,11,4,5,4,3,3,3,3,3,3,3,49,8.0,20.5,12.0,13.0,12.0,5.0,11.0,5.0,6.0,4.05,7.0,11.0,114.55
การขายส่งวัสดุที่ใช้ในการก่อสร้างผลิตภัณฑ์โลหะอุปกรณ์ระบบท่อโดยได้รับค่าตอบแทนหรือตามสัญญาจ้าง,14,13,17,11,16,10,15,10,12,10,17,21,166,77.5,36.9,54.0,37.0,52.2,30.7,45.1,18.05,21.3,74.0,35.2,36.5,518.45
การขายส่งสินค้าเฉพาะอย่างอื่นๆซึ่งมิได้จัดประเภทไว้ในที่อื่นโดยได้รับค่าตอบแทนหรือตามสัญญาจ้าง,9,8,6,3,1,0,4,7,3,4,6,0,51,13.0,12.2,14.5,14.2,4.0,0.0,5.0,27.0,8.0,8.5,10.1,0.0,116.5
การขายส่งสินค้าทั่วไปโดยได้รับค่าตอบแทนหรือตามสัญญาจ้าง,117,131,141,137,139,149,135,138,147,117,75,62,1488,329.535,253.682,282.75,318.755,251.36,247.16,243.971,236.22,271.711,205.931,110.46,137.1,2888.635
การขายส่งวัตถุดิบทางการเกษตรและสัตว์มีชีวิต,0,0,0,0,0,0,0,0,0,0,0,0,0,0.0,0.0,0.0,0.0,0.0,0.0,0.0,0.0,0.0,0.0,0.0,0.0,0.0
การขายส่งข้าวเปลือกและธัญพืชอื่นๆ,20,28,31,18,32,33,36,43,60,35,17,14,367,27.7,36.531,34.65,23.89,48.405,53.11,66.6,60.33,104.06,46.321,31.84,16.95,550.3870000000001
การขายส่งพืชน้ำมันที่ใช้ในการผลิตน้ำมันพืช,2,0,1,1,1,3,2,1,2,1,0,2,16,3.0,0.0,3.0,1.0,1.0,3.0,1.25,1.0,3.0,1.0,0.0,2.0,19.25
การขายส่งยาสูบที่ยังไม่เป็นผลิตภัณฑ์สำเร็จรูป,1,0,0,0,0,0,0,0,0,0,0,0,1,1.0,0.0,0.0,0.0,0.0,0.0,0.0,0.0,0.0,0.0,0.0,0.0,1.0
การขายส่งสัตว์มีชีวิต,13,15,11,17,10,24,31,26,26,15,3,4,195,23.525,193.35,19.3,117.45,6.77,20.695,37.3,26.47,27.4,15.702,6.5,5.0,499.462
การขายส่งดอกไม้ต้นไม้และเมล็ดพันธุ์พืช,5,7,4,6,2,2,4,7,3,8,10,1,59,12.5,8.0,7.201,9.1,2.6,2.3,3.5,8.1,2.6,9.0,13.1,1.0,79.001
การขายส่งอาหารสัตว์,21,3,18,12,17,26,16,21,20,25,17,9,205,30.1,2.5,31.0,13.5,27.55,31.6,24.1,32.6,39.75,61.2,13.5,12.5,319.9
การขายส่งวัตถุดิบอื่นๆทางการเกษตรซึ่งมิได้จัดประเภทไว้ในที่อื่น,43,27,26,19,39,21,28,24,24,21,19,17,308,66.355,33.2,39.1,29.6,75.4,42.8,40.05,34.9,33.3,27.22,35.0,24.4,481.32499999999993
การขายส่งอาหารเครื่องดื่มและยาสูบ,0,0,0,0,0,0,0,0,0,0,0,0,0,0.0,0.0,0.0,0.0,0.0,0.0,0.0,0.0,0.0,0.0,0.0,0.0,0.0
การขายส่งอาหาร,0,0,0,0,0,0,0,0,0,0,0,0,0,0.0,0.0,0.0,0.0,0.0,0.0,0.0,0.0,0.0,0.0,0.0,0.0,0.0
การขายส่งเนื้อสัตว์และผลิตภัณฑ์เนื้อสัตว์,21,15,15,10,6,16,14,18,21,21,17,23,197,26.4,27.5,20.8,10.8,7.2,35.0,21.0,47.0,51.0,32.6,31.4,29.85,340.55
การขายส่งปลาและผลิตภัณฑ์สัตว์น้ำ,16,12,11,8,10,9,12,13,21,15,10,8,145,26.2,17.75,16.0,10.3,23.001,14.75,16.0,17.0,30.6,25.11,11.55,7.5,215.761
การขายส่งผักและผลไม้,44,49,36,38,32,37,42,36,41,46,46,42,489,78.3,78.9,93.08,94.5,56.8,65.2,71.6,49.81,58.8,81.45,66.52,89.0,883.96
การขายส่งผลิตภัณฑ์นม,3,5,2,5,1,5,1,2,2,2,3,3,34,2.2,5.0,2.0,8.2,1.0,5.5,1.0,1.6,2.0,2.0,8.0,2.4,40.9
การขายส่งข้าวและผลิตภัณฑ์ที่ได้จากการโรงสีข้าว,5,3,0,4,3,5,3,2,3,7,2,4,41,9.0,7.5,0.0,4.0,7.0,6.0,7.5,6.0,7.0,7.4,0.6,12.0,74.0
การขายส่งผลิตภัณฑ์ขนมอบไข่น้ำมันและไขมันที่ใช้ในการบริโภค,3,5,4,1,1,5,2,2,3,1,3,1,31,3.0,11.0,4.0,1.0,20.0,57.0,2.0,2.0,3.0,5.0,2.1,4.0,114.1
การขายส่งน้ำตาลช็อกโกแลตและลูกกวาด,0,0,2,1,1,0,4,1,3,0,1,0,13,0.0,0.0,2.0,1.0,5.0,0.0,5.5,2.0,2.01,0.0,20.0,0.0,37.51
การขายส่งกาแฟชาโกโก้,8,7,13,9,6,2,15,6,10,21,14,4,115,10.4,9.0,23.6,10.604,4.4,7.0,18.5,12.8,19.2,29.6,21.65,3.001,169.755
การขายส่งผลิตภัณฑ์อาหารอื่นๆซึ่งมิได้จัดประเภทไว้ในที่อื่น,76,92,114,81,65,67,84,108,141,83,76,34,1021,177.2,154.4005,159.71,112.501,91.0,79.95,122.075,126.521,182.824999,222.3,201.79,41.08,1671.352499
การขายส่งเครื่องดื่มและยาสูบ,0,0,0,0,0,0,0,0,0,0,0,0,0,0.0,0.0,0.0,0.0,0.0,0.0,0.0,0.0,0.0,0.0,0.0,0.0,0.0
การขายส่งเครื่องดื่มที่มีแอลกอฮอล์,7,13,6,10,4,4,6,6,2,8,10,6,82,18.2,31.5,7.1,14.8,12.0,5.0,13.0,8.1,3.0,8.45,15.0,11.7,147.85
การขายส่งเครื่องดื่มที่ไม่มีแอลกอฮอล์,13,13,10,4,5,2,4,4,2,6,12,9,84,17.5,14.8,11.8,5.21,14.0,2.0,5.0,4.0,3.0,13.0,18.0,23.6,131.91
การขายส่งผลิตภัณฑ์ยาสูบ,3,0,0,1,0,0,0,0,0,2,1,0,7,4.0,0.0,0.0,0.1,0.0,0.0,0.0,0.0,0.0,7.0,2.0,0.0,13.1
การขายส่งสินค้าในครัวเรือน,0,0,0,0,0,0,0,0,0,0,0,0,0,0.0,0.0,0.0,0.0,0.0,0.0,0.0,0.0,0.0,0.0,0.0,0.0,0.0
การขายส่งสิ่งทอเสื้อผ้าและรองเท้า,0,0,0,0,0,0,0,0,0,0,0,0,0,0.0,0.0,0.0,0.0,0.0,0.0,0.0,0.0,0.0,0.0,0.0,0.0,0.0
การขายส่งด้ายและผ้า,12,24,50,39,34,20,33,37,59,21,23,4,356,19.5,38.5,72.35,57.825,42.3,23.5,41.215,37.481,96.85,33.3,35.802,6.0,504.6230000000001
การขายส่งของใช้ในครัวเรือนที่ทำจากสิ่งทอ,3,5,1,1,1,2,1,1,2,9,10,5,41,6.2,28.0,1.0,5.0,2.0,3.0,1.0,2.0,1.012,8.3,26.0,7.0,90.512
การขายส่งอุปกรณ์ตัดเย็บ,0,2,0,0,0,2,0,0,0,1,0,0,5,0.0,6.0,0.0,0.0,0.0,2.0,0.0,0.0,0.0,1.0,0.0,0.0,9.0
การขายส่งเสื้อผ้า,41,23,32,30,12,25,23,25,28,26,35,31,331,66.0,47.12,126.1,44.8,24.0,37.6395,28.705,39.7,36.65,44.4,67.014,588.604,1150.7325
การขายส่งรองเท้า,0,1,1,1,0,4,1,0,2,1,2,3,16,0.0,1.0,1.0,2.0,0.0,10.0,5.0,0.0,5.0,1.0,2.8,4.0,31.8
การขายส่งเครื่องใช้ไฟฟ้าและอิเล็กทรอนิกส์ชนิดใช้ในครัวเรือน,0,0,0,0,0,0,0,0,0,0,0,0,0,0.0,0.0,0.0,0.0,0.0,0.0,0.0,0.0,0.0,0.0,0.0,0.0,0.0
การขายส่งเครื่องใช้ไฟฟ้าและอิเล็กทรอนิกส์ชนิดใช้ในครัวเรือน,15,21,12,18,19,13,19,17,21,22,23,18,218,35.2,44.1,17.5,136.5,36.7,23.5,32.0,40.5,226.2,37.3,45.31,39.1,713.91
การขายส่งอุปกรณ์สำหรับให้แสงสว่าง,6,6,1,5,7,4,6,6,7,4,1,3,56,10.0,11.7,1.0,9.0,12.0,8.0,6.2,18.5,11.0,9.25,1.0,11.0,108.65
การขายส่งหนังสือหนังสือพิมพ์และเครื่องเขียน,12,19,9,5,11,14,14,15,24,8,15,12,158,11.6225,23.01,9.5,9.1,19.55,119.3,17.0,34.022,21.05,8.5,30.0,4.17,306.8245
การขายส่งสื่อบันทึกเสียงและวีดิทัศน์ที่บันทึกข้อมูลแล้ว,0,0,0,0,0,0,1,0,0,0,0,0,1,0.0,0.0,0.0,0.0,0.0,0.0,3.0,0.0,0.0,0.0,0.0,0.0,3.0
การขายส่งเครื่องกีฬา,7,7,8,12,5,5,5,7,7,8,7,6,84,8.78,11.0,12.0,21.09,11.0,6.0,8.0,14.1,18.0,6.9,8.73,15.1,140.70000000000002
การขายส่งเกมและของเล่น,10,4,9,3,2,6,13,6,13,6,1,0,73,15.4,5.0,113.1,6.0,2.8,5.6,17.3,6.5,8.0012,10.51,1.0,0.0,191.2112
การขายส่งสินค้าวัฒนธรรมและนันทนาการอื่นๆซึ่งมิได้จัดประเภทไว้ในที่อื่น,4,3,1,3,2,3,2,6,2,3,2,1,32,13.0,2.7,1.0,3.0,6.0,3.5,3.0,9.75,1.2,2.6,6.0,1.0,52.75000000000001
การขายส่งสินค้าทางเภสัชภัณฑ์และทางการแพทย์เครื่องหอมและเครื่องสำอาง,0,0,0,0,0,0,0,0,0,0,0,0,0,0.0,0.0,0.0,0.0,0.0,0.0,0.0,0.0,0.0,0.0,0.0,0.0,0.0
การขายส่งสินค้าทางเภสัชภัณฑ์และทางการแพทย์,73,72,76,64,77,78,98,75,67,94,67,46,887,128.05,131.1,115.5,102.5,181.202,95.752,250.3,115.78,95.45,162.185,115.61,97.65,1591.079
การขายส่งเครื่องหอม,7,3,2,1,2,4,5,1,2,5,1,1,34,14.0,5.0,2.1,1.0,7.0,5.0,4.1,2.0,6.0,3.55,1.0,4.0,54.75
การขายส่งเครื่องสำอาง,60,55,43,42,38,63,50,54,64,51,51,37,608,117.53,88.7,57.887,64.7,116.755555,179.2201,258.4,68.65,105.01,94.1,72.012,65.45,1288.4146549999998
การขายส่งสินค้าในครัวเรือนอื่นๆ,0,0,0,0,0,0,0,0,0,0,0,0,0,0.0,0.0,0.0,0.0,0.0,0.0,0.0,0.0,0.0,0.0,0.0,0.0,0.0
การขายส่งอุปกรณ์ถ่ายภาพและทัศนศาสตร์,1,0,3,1,0,1,2,2,0,1,0,1,12,4.0,0.0,2.505,5.0,0.0,1.0,3.0,3.0,0.0,1.0,0.0,5.0,24.505
การขายส่งนาฬิกาและเครื่องประดับ,9,9,5,7,2,1,10,6,7,10,2,8,76,65.0,37.0,13.0,10.6,5.0,5.0,38.0,16.0,10.5,28.1,9.0,30.0,267.2
การขายส่งเครื่องหนังและเครื่องใช้สำหรับการเดินทาง,5,5,3,2,1,0,0,0,0,1,1,1,19,3.0,10.006,5.0,2.0,100.0,0.0,0.0,0.0,0.0,1.0,1.0,1.0,123.006
การขายส่งเฟอร์นิเจอร์ชนิดใช้ในครัวเรือน,9,22,21,21,23,25,28,38,26,37,15,6,271,19.2,49.0177,50.1,30.0,61.11,34.71,49.8,44.7055,46.9,81.1,32.58,8.1,507.3232
การขายส่งเครื่องดินเผาเครื่องแก้วและเครื่องครัว,2,3,0,2,0,1,1,1,2,3,1,1,17,4.0,2.1,0.0,3.0,0.0,1.0,43.0,1.0,1.5,6.05,0.5,2.0,64.15
การขายส่งสินค้าในครัวเรือนอื่นๆซึ่งมิได้จัดประเภทไว้ในที่อื่น,9,20,14,8,10,6,15,13,10,13,7,5,130,12.0,30.2,20.1,12.1,13.6,5.08,27.55,27.6,11.1,21.2,12.2,7.0,199.73
การขายส่งเครื่องจักรอุปกรณ์และเครื่องมือเครื่องใช้ต่างๆ,0,0,0,0,0,0,0,0,0,0,0,0,0,0.0,0.0,0.0,0.0,0.0,0.0,0.0,0.0,0.0,0.0,0.0,0.0,0.0
การขายส่งคอมพิวเตอร์อุปกรณ์ต่อพ่วงคอมพิวเตอร์และซอฟต์แวร์,43,23,33,28,14,28,28,22,21,14,8,12,274,90.4,48.75,56.1,48.8,17.0,58.4,39.33,120.78,40.06,17.7,11.0,17.8,566.1199999999999
การขายส่งอุปกรณ์และชิ้นส่วนทางอิเล็กทรอนิกส์และทางการสื่อสารโทรคมนาคม,0,0,0,0,0,0,0,0,0,0,0,0,0,0.0,0.0,0.0,0.0,0.0,0.0,0.0,0.0,0.0,0.0,0.0,0.0,0.0
การขายส่งอุปกรณ์และชิ้นส่วนอิเล็กทรอนิกส์,30,34,32,18,20,21,27,36,20,21,17,15,291,102.5,244.8,228.9,31.5,74.0,50.5,47.1,69.15,107.0,41.0,28.25,24.2,1048.9
การขายส่งโทรศัพท์และอุปกรณ์การสื่อสารโทรคมนาคม,10,15,15,13,2,24,28,19,26,21,12,6,191,15.0,62.5,23.0,17.1,9.0,41.0,40.0,26.9,31.8,31.0,20.0,6.00001,323.30001
การขายส่งเครื่องจักรอุปกรณ์และเครื่องใช้ทางการเกษตร,15,16,9,10,9,15,10,19,19,11,12,7,152,531.9,21.5,23.1,11.0,14.0,19.2,8.85,26.45,27.80496,17.0,16.0,7.1,723.9049600000002
การขายส่งเครื่องจักรและอุปกรณ์อื่นๆ,0,0,0,0,0,0,0,0,0,0,0,0,0,0.0,0.0,0.0,0.0,0.0,0.0,0.0,0.0,0.0,0.0,0.0,0.0,0.0
การขายส่งอุปกรณ์ขนส่ง (ยกเว้นยานยนต์จักรยานยนต์และจักรยาน),8,3,10,5,2,6,4,4,4,6,1,1,54,20.0,3.5,17.5,11.0,7.0,33.1,4.01,7.5,8.0,10.1,3.0,1.0,125.71
การขายส่งเครื่องจักรและอุปกรณ์งานวิศวกรรมโยธางานเหมืองแร่และงานก่อสร้าง,9,4,5,5,7,5,3,10,2,5,6,1,62,19.1,12.0,7.0,6.0,31.1,18.0,10.0,15.1,3.0,10.0,14.5,1.0,146.8
การขายส่งเครื่องจักรและอุปกรณ์เพื่อใช้ในงานอุตสาหกรรม,26,22,20,13,14,20,32,22,17,19,16,20,241,36.2,33.7,67.0,20.0,21.6,30.0,68.2,55.6,28.0,25.3,32.2,54.1,471.9
การขายส่งเครื่องจักรอุปกรณ์และเฟอร์นิเจอร์ชนิดใช้ในสำนักงาน,5,5,5,5,8,4,8,4,3,5,3,3,58,12.5,9.0,10.0,5.5,8.1,3.6,12.5,5.0,1.6,9.0,2.2,14.5,93.5
การขายส่งเครื่องจักรและอุปกรณ์อื่นๆซึ่งมิได้จัดประเภทไว้ในที่อื่น,131,94,98,91,80,92,116,88,96,96,63,52,1097,292.605,268.97,265.131,377.2,226.9,158.055,223.62,482.95,434.11,184.5,105.0,95.82,3114.8610000000003
การขายส่งสินค้าเฉพาะทางอื่นๆ,0,0,0,0,0,0,0,0,0,0,0,0,0,0.0,0.0,0.0,0.0,0.0,0.0,0.0,0.0,0.0,0.0,0.0,0.0,0.0
การขายส่งเชื้อเพลิงแข็งเชื้อเพลิงเหลวและเชื้อเพลิงก๊าซ รวมทั้งผลิตภัณฑ์ที่เกี่ยวเนื่อง,0,0,0,0,0,0,0,0,0,0,0,0,0,0.0,0.0,0.0,0.0,0.0,0.0,0.0,0.0,0.0,0.0,0.0,0.0,0.0
การขายส่งเชื้อเพลิงแข็ง,1,2,1,0,2,0,1,3,7,5,1,4,27,5.0,2.0,5.0,0.0,51.0,0.0,1.0,6.0,20.0,119.0,1.0,5.5,215.5
การขายส่งเชื้อเพลิงเหลว,7,6,8,4,3,3,2,7,6,8,4,3,61,9.659465,21.0,13.0,55.0,4.0,26.0,6.0,11.0101,14.5,19.0,12.0,11.0,202.169565
การขายส่งเชื้อเพลิงก๊าซ,2,1,2,2,1,2,1,0,1,1,1,0,14,2.0,1.0,6.0,10.0,1.0,2.0,30.0,0.0,1.0,1.0,1.0,0.0,55.0
การขายส่งผลิตภัณฑ์ที่ได้จากการกลั่นปิโตรเลียม,5,9,4,2,7,2,5,7,7,5,2,0,55,10.0,11.0,3.5,3.0,154.0,1.8,10.0,209.5,108.2,9.0,2.0,0.0,522.0
การขายส่งโลหะและสินแร่โลหะ,0,0,0,0,0,0,0,0,0,0,0,0,0,0.0,0.0,0.0,0.0,0.0,0.0,0.0,0.0,0.0,0.0,0.0,0.0,0.0
การขายส่งแร่โลหะที่เป็นเหล็กและนอกกลุ่มเหล็ก,8,7,7,8,4,5,8,10,3,4,6,10,80,24.0,8.0,14.0,13.5,10.0,35.0,14.0,16.1,6.0,8.0,12.0,28.0,188.6
การขายส่งเหล็กเหล็กกล้าและโลหะที่นอกกลุ่มเหล็กขั้นมูลฐาน,12,10,6,5,10,12,14,9,8,12,7,7,112,20.0,11.84,7.0,8.2,16.2,24.1,16.55,107.05,85.9,116.0,18.0,15.0,445.84
การขายส่งวัสดุก่อสร้างเครื่องโลหะอุปกรณ์และเครื่องมือเครื่องใช้เกี่ยวกับการวางท่อและการทำความร้อน,0,0,0,0,0,0,0,0,0,0,0,0,0,0.0,0.0,0.0,0.0,0.0,0.0,0.0,0.0,0.0,0.0,0.0,0.0,0.0
การขายส่งอิฐหินปูนทรายและผลิตภัณฑ์คอนกรีต,10,11,7,7,9,8,4,7,15,7,4,7,96,22.2,20.0,9.5,12.0,19.0,49.2,3.2,11.0,37.8,13.5,4.0,15.999999,217.399999
การขายส่งไม้และผลิตภัณฑ์จากไม้แปรรูปขั้นต้น,19,18,12,11,7,11,15,12,12,17,10,4,148,34.0,37.65,16.8,22.0,15.1,19.0,25.3,36.0,25.0,34.5,20.68,9.0,295.03000000000003
การขายส่งสีทาน้ำมันชักเงาและแลกเกอร์,3,2,2,2,0,2,0,4,2,1,0,1,19,14.0,6.0,1.5,11.0,0.0,2.0,0.0,14.0,6.0,5.0,0.0,1.0,60.5
การขายส่งอุปกรณ์การวางท่อและเครื่องสุขภัณฑ์,1,1,0,1,0,1,1,1,1,1,0,2,10,5.0,5.0,0.0,2.0,0.0,0.006,5.0,5.0,1.0,1.0,0.0,1.5,25.506
การขายส่งวัสดุก่อสร้างอื่นๆซึ่งมิได้จัดประเภทไว้ในที่อื่น,38,29,29,37,24,36,32,47,41,32,15,21,381,78.2,87.7,70.4,63.46,43.0,68.5,68.01,97.0,90.1,67.73,21.6,60.1,815.8000000000001
การขายส่งเคมีภัณฑ์ทางอุตสาหกรรม,15,15,14,24,15,13,22,15,18,14,12,7,184,27.5,48.5,18.7,125.4,21.3,20.1,329.8,42.1,36.0,124.5,16.7,12.0,822.6000000000001
